,Code,Description
1606,EPH,"Ephrata/Moses Lake, WA: Ephrata Municipal"
1607,EPL,"Epinal, France: Epinal Mirecourt"
1608,EPN,"Epena, Congo (Brazaville): Epena Airport"
1609,EPR,"Esperance, Australia: Esperance Airport"
1610,EQS,"Esquel, Argentina: Esquel Airport"
1611,ERA,"Erigavo, Somalia: Erigavo Airport"
1612,ERC,"Erzincan, Turkey: Erzincan Airport"
1613,ERD,"Berdyansk, Ukraine: Berdyansk Airport"
1614,ERF,"Erfurt, Germany: Erfurt Weimar"
1615,ERI,"Erie, PA: Erie International/Tom Ridge Field"
1616,ERM,"Erechim, Brazil: Erechim Airport"
1617,ERN,"Eirunepe, Brazil: Eirunepe Airport"
1618,ERS,"Windhoek, Namibia: Eros"
1619,ERT,"Erdenet, Mongolia: Erdenet Airport"
1620,ERV,"Kerrville, TX: Kerrville Municipal/Louis Schreiner Field"
1621,ERZ,"Erzurum, Turkey: Erzurum Airport"
1622,ES1,"Madrid, Spain: Getafe"
1623,ESA,"Esa'ala, Papua New Guinea: Esa'ala Airport"
1624,ESB,"Ankara, Turkey: Esenboga"
1625,ESC,"Escanaba, MI: Delta County"
1626,ESD,"Eastsound, WA: Orcas Island"
1627,ESE,"Ensenada, Mexico: General Alberto L. Salinas Carranza"
1628,ESF,"Alexandria, LA: Esler Regional"
1629,ESM,"Esmeraldas, Ecuador: Coronel Carlos Concha Torres"
1630,ESN,"Easton, MD: Easton/Newnam Field"
1631,ESP,"Stroudsburg, PA: Stroudsburg Pocono"
1632,ESR,"El Salvador, Chile: Ricardo Garcia Posada"
1633,ESS,"Essen, Germany: Essen Mulheim"
1634,ETH,"Eilat, Israel: Eilat Airport"
1635,ETN,"Eastland, TX: Eastland Municipal"
1636,ETS,"Enterprise, AL: Enterprise Municipal"
1637,ETZ,"Metz/Nancy, France: Metz Nancy Lorraine"
1638,EUA,"Eua, Tonga: Eua Airport"
1639,EUE,"Eureka, NV: Eureka Airport"
1640,EUF,"Eufaula, AL: Weedon Field"
1641,EUG,"Eugene, OR: Mahlon Sweet Field"
1642,EUN,"Laayoune, Morocco: Hassan I International"
1643,EUX,"St. Eustatius, Bonaire, Sint Eustatius, and Saba: F.D. Roosevelt"
1644,EVC,"Eva Creek, AK: Eva Creek Airport"
1645,EVE,"Evenes, Norway: Evenes Airport"
1646,EVG,"Sveg, Sweden: Sveg Airport"
1647,EVM,"Eveleth, MN: Eveleth Virginia Municipal"
1648,EVN,"Yerevan, Armenia: Zvartnots"
1649,EVV,"Evansville, IN: Evansville Regional"
1650,EVW,"Evanston, WY: Evanston-Uinta County Burns Field"
1651,EVX,"Evreux, France: Evreux Fauville"
1652,EWB,"New Bedford/Fall River, MA: New Bedford Regional"
1653,EWK,"Newton, KS: Newton City County"
1654,EWN,"New Bern/Morehead/Beaufort, NC: Coastal Carolina Regional"
1655,EWR,"Newark, NJ: Newark Liberty International"
1656,EXI,"Excursion Inlet, AK: Excursion Inlet Seaplane Base"
1657,EXT,"Exeter, United Kingdom: Exeter Airport"
1658,EXU,"George Town, The Bahamas: George Town Airport"
1659,EYL,"Yelimane, Mali: Yelimane Airport"
1660,EYP,"El Yopal, Colombia: El Yopal Airport"
1661,EYW,"Key West, FL: Key West International"
1662,EZE,"Ezeiza, Argentina: Ministro Pistarini"
1663,EZS,"Elazig, Turkey: Elazig Airport"
1664,F70,"Murrieta/Temecula, CA: French Valley"
1665,FAB,"Farnborough, United Kingdom: Farnborough Airport"
1666,FAE,"Sorvagur, Denmark: Vagar"
1667,FAI,"Fairbanks, AK: Fairbanks International"
1668,FAJ,"Fajardo, PR: Diego Jimenez Torres"
1669,FAK,"False Island, AK: False Island Airport"
1670,FAL,"Roma, TX: Falcon State Park"
1671,FAM,"Farmington, MO: Farmington Regional"
1672,FAN,"Farsund, Norway: Lista"
1673,FAO,"Faro, Portugal: Faro Airport"
1674,FAQ,"Fitiuta Village, TT: Fitiuta"
1675,FAR,"Fargo, ND: Hector International"
1676,FAT,"Fresno, CA: Fresno Yosemite International"
1677,FAU,"Fairmount Island, AK: Fairmount Island Airport"
1678,FAV,"Fakarava, French Polynesia: Fakarava Airport"
1679,FAY,"Fayetteville, NC: Fayetteville Regional/Grannis Field"
1680,FBG,"Fort Bragg, NC: Simmons AAF"
1681,FBK,"Fairbanks, AK: Ladd AAF"
1682,FBM,"Lubumbashi, Congo (Kinshasa): Lubumbashi International"
1683,FBR,"Fort Bridger, WY: Fort Bridger Airport"
1684,FBS,"Friday Harbor, WA: Friday Harbor Seaplane Base"
1685,FBU,"Oslo, Norway: Fornebu"
1686,FCA,"Kalispell, MT: Glacier Park International"
1687,FCH,"Fresno, CA: Fresno Chandler Executive"
1688,FCM,"Minneapolis, MN: Flying Cloud"
1689,FCN,"Nordholz, Germany: Nordholz Airport"
1690,FCO,"Rome, Italy: Fiumicino"
1691,FCS,"Colorado Springs, CO: Butts AAF"
1692,FDE,"Forde, Norway: Forde Airport"
1693,FDF,"Fort de France, Martinique: Martinique Aime Cesaire"
1694,FDH,"Friedrichshafen, Germany: Friedrichshafen Airport"
1695,FDK,"Frederick, MD: Frederick Municipal"
1696,FDR,"Frederick, OK: Frederick Regional"
1697,FDU,"Bandundu, Congo (Kinshasa): Bandundu Airport"
1698,FDY,"Findlay, OH: Findlay Airport"
1699,FEG,"Fergana, Uzbekistan: Fergana Airport"
1700,FEN,"Fernando de Noronha, Brazil: Fernando de Noronha Airport"
1701,FEP,"Freeport, IL: Albertus"
1702,FET,"Fremont, NE: Fremont Municipal"
1703,FEW,"Cheyenne, WY: Francis E. Warren AFB Heliport"
1704,FEZ,"Fez, Morocco: Saiss International"
1705,FFD,"Fairford, United Kingdom: RAF Fairford"
1706,FFM,"Fergus Falls, MN: Fergus Falls Municipal-Einar Mickelson Field"
1707,FFO,"Dayton, OH: Wright-Patterson AFB"
1708,FFT,"Frankfort, KY: Capital City"
1709,FGD,"Fderik, Mauritania: Fderik Airport"
1710,FGI,"Apia, Samoa: Fagali I"
1711,FHB,"Fernandina Beach, FL: Fernandina Beach Municipal"
1712,FHU,"Fort Huachuca, AZ: Sierra Vista Municipal-Libby AAF"
1713,FIC,"Fire Cove, AK: Fire Cove Airport"
1714,FID,"Fishers Island, NY: Elizabeth Field"
1715,FIH,"Kinshasa, Congo (Kinshasa): N'Djili International"
1716,FIL,"Fillmore, UT: Fillmore Municipal"
1717,FIN,"Finschhafen, Papua New Guinea: Finschhafen Airport"
1718,FIZ,"Fitzroy Crossing, Australia: Fitzroy Crossing Airport"
1719,FJR,"Al-Fujairah, United Arab Emirates: Fujairah International"
1720,FKB,"Karlsruhe/Baden-Baden, Germany: Karlsruhe/Baden-Baden Airport"
1721,FKI,"Kisangani, Congo (Kinshasa): Bangoka International"
1722,FKJ,"Fukui, Japan: Fukui Airport"
1723,FKL,"Franklin/Oil City, PA: Venango Regional"
1724,FKS,"Fukushima, Japan: Fukushima Airport"
1725,FL1,"Zephyrhills, FL: Zephyrhills Municipal"
1726,FL2,"Valkaria, FL: Valkaria Airport"
1727,FL3,"Chipley, FL: Vosikas"
1728,FL4,"Bunnell, FL: Flagler County"
1729,FL5,"Williston, FL: Williston Municipal"
1730,FL6,"Clewiston, FL: Airglades"
1731,FLA,"Florencia, Colombia: Gustavo Artunduaga Paredes"
1732,FLB,"Floriano, Brazil: Floriano Airport"
1733,FLD,"Fond Du Lac, WI: Fond Du Lac County"
1734,FLF,"Flensburg, Germany: Flensburg Schaferhaus"
1735,FLG,"Flagstaff, AZ: Flagstaff Pulliam"
1736,FLJ,"Falls Bay, AK: Falls Bay Airport"
1737,FLL,"Fort Lauderdale, FL: Fort Lauderdale-Hollywood International"
1738,FLN,"Florianopolis, Brazil: Hercilio Luz International"
1739,FLO,"Florence, SC: Florence Regional"
1740,FLR,"Florence, Italy: Firenze"
1741,FLS,"Flinders Island, Australia: Flinders Island Airport"
1742,FLT,"Flat, AK: Flat Airport"
1743,FLU,"New York, NY: Flushing"
1744,FLV,"Leavenworth, KS: Sherman AAF"
1745,FLW,"Santa Cruz das Flores, Portugal: Flores"
1746,FLX,"Fallon, NV: Fallon Municipal"
1747,FMA,"Formosa, Argentina: Formosa Airport"
1748,FMC,"Five Mile Camp, AK: Five Mile Camp Airport"
1749,FMH,"Falmouth, MA: Cape Cod CGAS"
1750,FMI,"Kalemie, Congo (Kinshasa): Kalemie Airport"
1751,FMM,"Memmingen, Germany: Memmingen Airport"
1752,FMN,"Farmington, NM: Four Corners Regional"
1753,FMO,"Greven, Germany: Munster/Osnabruck"
1754,FMS,"Fort Madison, IA: Fort Madison Municipal"
1755,FMY,"Fort Myers, FL: Page Field"
1756,FNA,"Freetown, Sierra Leone: Freetown Lungi"
1757,FNC,"Funchal, Portugal: Madeira"
1758,FNI,"Nimes, France: Nimes Garons"
1759,FNJ,"Pyongyang, North Korea: Pyongyang International"
1760,FNL,"Fort Collins/Loveland, CO: Fort Collins-Loveland Municipal"
1761,FNR,"Funter Bay Alaska, AK: Funter Bay"
1762,FNT,"Flint, MI: Bishop International"
1763,FOA,"Fortuna Ledge, AK: Marshall Field"
1764,FOB,"Fort Bragg, CA: Fort Bragg Airport"
1765,FOC,"Fuzhou, China: Changle"
1766,FOD,"Fort Dodge, IA: Fort Dodge Regional"
1767,FOE,"Topeka, KS: Forbes Field"
1768,FOG,"Foggia, Italy: Foggia Airport"
1769,FOK,"Westhampton, NY: Francis S. Gabreski"
1770,FON,"San Carlos, Costa Rica: Arenal"
1771,FOR,"Fortaleza, Brazil: Pinto Martins International"
1772,FPO,"Freeport, The Bahamas: Grand Bahama International"
1773,FPR,"Fort Pierce, FL: St. Lucie County International"
1774,FPY,"Perry, FL: Perry-Foley"
1775,FQA,"Patching Lake, AK: Patching Lake Airport"
1776,FQB,"Ventura, CA: San Nicolas Island NOLF"
1777,FQC,"Kodiak, AK: Lilly Lake"
1778,FQD,"Katmai National Park, AK: Trident Volcano"
1779,FQE,"Annex Creek, AK: Annex Creek Airport"
1780,FQF,"Davidson Creek, AK: Davidson Creek Airport"
1781,FQG,"Snettisham, AK: Snettisham Airport"
1782,FQH,"Fire Island, AK: Fire Island Airport"
1783,FQI,"Scott, KY: Georgetown Scott County - Marshall Field"
1784,FQJ,"Greens Creek, AK: Greens Creek Airport"
1785,FQK,"Gull Cove, AK: Gull Cove Airport"
1786,FQL,"Flora, IL: Flora Municipal"
1787,FQN,"Karta Lake, AK: Karta Lake Airport"
1788,FQO,"Manzanita Lake, AK: Manzanita Lake Airport"
1789,FQP,"Shrimp Bay, AK: Shrimp Bay Airport"
1790,FQQ,"Dry Bay, AK: Dry Bay Airport"
1791,FQR,"Josephine Lake, AK: Josephine Lake Airport"
1792,FQU,"Libby, MT: Libby Airport"
1793,FQV,"Volcano Bay, AK: Volcano Bay Airport"
1794,FQW,"Fort Glenn, AK: Fort Glenn Airport"
1795,FQX,"Babe Islands, AK: Babe Islands Airport"
1796,FQY,"Kahli Cove, AK: Kahli Cove Airport"
1797,FRA,"Frankfurt, Germany: Frankfurt Main"
1798,FRC,"Franca, Brazil: Franca Airport"
1799,FRD,"Friday Harbor, WA: Friday Harbor Airport"
1800,FRF,"Frankfurt, Germany: Rhein Main AFB"
1801,FRG,"East Farmingdale, NY: Republic"
1802,FRL,"Forli, Italy: Forli Airport"
1803,FRM,"Fairmont, MN: Fairmont Municipal"
1804,FRO,"Floro, Norway: Floro Airport"
1805,FRP,"Fresh Water Bay, AK: Fresh Water Bay Airport"
1806,FRR,"Front Royal, VA: Front Royal-Warren County"
1807,FRS,"Flores, Guatemala: Flores Airport"
1808,FRU,"Bishkek, Kyrgyzstan: Manas"
1809,FRW,"Francistown, Botswana: Francistown Airport"
1810,FRY,"Fryeburg, ME: Eastern Slopes Regional"
1811,FSC,"Figari, France: Figari Sud Corse"
1812,FSD,"Sioux Falls, SD: Joe Foss Field"
1813,FSI,"Fort Sill, OK: Henry Post AAF"
1814,FSK,"Fort Scott, KS: Fort Scott Municipal"
1815,FSM,"Fort Smith, AR: Fort Smith Regional"
1816,FSP,"St. Pierre, Saint Pierre and Miquelon: Saint Pierre"
1817,FSS,"Forres, United Kingdom: RAF Kinloss"
1818,FST,"Ft. Stockton, TX: Fort Stockton Pecos County"
1819,FSZ,"Shizuoka, Japan: Shizuoka Airport"
1820,FTC,"Fort Collins, CO: Fort Collins Airpark"
1821,FTE,"El Calafate, Argentina: El Calafate Airport"
1822,FTG,"Denver, CO: Front Range"
1823,FTK,"Fort Knox, KY: Godman AAF"
1824,FTL,"Fortuna Ledge, AK: Fortuna Ledge Airport"
1825,FTU,"Fort Dauphin, Madagascar: Marillac"
1826,FTV,"Masvingo, Zimbabwe: Masvingo Airport"
1827,FTW,"Dallas/Fort Worth, TX: Fort Worth Meacham International"
1828,FTY,"Atlanta, GA: Fulton County Airport-Brown Field"
1829,FUE,"Fuerteventura, Spain: Fuerteventura Airport"
1830,FUJ,"Fukue, Japan: Fukue Airport"
1831,FUK,"Fukuoka, Japan: Fukuoka Airport"
1832,FUL,"Fullerton, CA: Fullerton Municipal"
1833,FUN,"Funafuti, Tuvalu: Funafuti International"
1834,FUT,"Futuna Island, Wallis and Futuna: Futuna Pointe Vele"
1835,FVA,"Osprey Lodge, AK: Osprey Lodge Airport"
1836,FVB,"Baledogle, Somalia: Baledogle Airport"
1837,FVC,"Baikonour, Kazakhstan: Baikonour Airport"
1838,FVD,"Sonora, TX: Sonora Municipal"
1839,FVE,"Fallbrook, CA: Fallbrook Community Airpark"
1840,FVF,"Dadaab, Kenya: Hagadera"
1841,FVG,"Wickenburg, AZ: Wickenburg Municipal"
1842,FVH,"Othello, WA: Othello Municipal"
1843,FVI,"Lake Providence, LA: Byerley"
1844,FVJ,"Amberley, Australia: Amberley Airport"
1845,FVL,"Colusa, CA: Colusa Airport"
1846,FVN,"Culbertson, MT: Big Sky Field"
1847,FVO,"Aurora, OR: Aurora State"
1848,FVP,"Quincy, CA: Gansner Field"
1849,FVQ,"Donlin Creek Mine, AK: Donlin Creek Mine Airport"
1850,FVR,"Three Forks, MT: Three Forks Airport"
1851,FVS,"Rexburg, ID: Rexburg-Madison County"
1852,FVT,"Latacunga, Ecuador: Latacunga Airport"
1853,FVU,"Las Palmas, Peru: Las Palmas Airport"
1854,FVV,"Kernville, CA: Kern Valley"
1855,FVW,"Golden Creek Mine, AK: Golden Creek Mine Airport"
1856,FVX,"Grace Harbor, AK: Grace Harbor Airport"
1857,FVY,"Unuk River, AK: Unuk River Airport"
1858,FVZ,"Deadhorse, AK: Inigok"
1859,FWA,"Fort Wayne, IN: Fort Wayne International"
1860,FWH,"Fort Worth, TX: Fort Worth NAS JRB/Carswell Field"
1861,FWL,"Farewell, AK: Farewell Airport"
1862,FWS,"Fort Worth, TX: Fort Worth Spinks"
1863,FXE,"Fort Lauderdale, FL: Fort Lauderdale Executive"
1864,FXM,"Flaxman Island, AK: Flaxman AFS"
1865,FXO,"Nova Freixo, Mozambique: Nova Freixo Airport"
1866,FXR,"Clinton, IN: Frankfort Municipal"
1867,FXY,"Forest City, IA: Forest City Municipal"
1868,FYT,"Faya-Largeau, Chad: Faya-Largeau Airport"
1869,FYU,"Fort Yukon, AK: Fort Yukon Airport"
1870,FYV,"Fayetteville, AR: Drake Field"
1871,FZO,"Filton, United Kingdom: Bristol Filton"
1872,GA0,"Eastman, GA: Heart of Georgia Regional"
1873,GA1,"Lafayette, GA: Barwick Lafayette"
1874,GA2,"Carrollton, GA: West Georgia Regional - O V Gray Field"
1875,GA3,"Atlanta, GA: Newnan Coweta County"
1876,GA4,"Jefferson, GA: Jackson County"
1877,GA5,"Thomson, GA: Thomson McDuffie County"
1878,GA6,"Canton, GA: Cherokee County"
1879,GAC,"Gracias, Honduras: Gracias Airport"
1880,GAD,"Gadsden, AL: Northeast Alabama Regional"
1881,GAE,"Gabes, Tunisia: Matmata Northeast"
1882,GAI,"Gaithersburg, MD: Montgomery County Airpark"
1883,GAJ,"Yamagata, Japan: Yamagata Airport"
1884,GAL,"Galena, AK: Edward G. Pitka Sr."
1885,GAM,"Gambell, AK: Gambell Airport"
1886,GAN,"Gan Island, Maldives: Gan Island Airport"
1887,GAO,"Guantanamo, Cuba: Los Canos"
1888,GAQ,"Gao, Mali: Gao Airport"
1889,GAR,"Garaina, Papua New Guinea: Garaina Airport"
1890,GAT,"Gap, France: Gap Tallard"
1891,GAU,"Guwahati, India: Guwahati International"
1892,GAW,"Gangaw, Burma: Gangaw Airport"
1893,GAY,"Gaya, India: Gaya Airport"
1894,GB1,"Suffolk, United Kingdom: Wattisham"
1895,GBA,"Goose Bay, AK: Goose Bay AAF"
1896,GBD,"Great Bend, KS: Great Bend Municipal"
1897,GBE,"Gaborone, Botswana: Sir Seretse Khama International"
1898,GBG,"Galesburg, IL: Galesburg Municipal"
1899,GBH,"Galbraith Lake, AK: Galbraith Lake Airport"
1900,GBJ,"Marie Galante, Guadeloupe: Marie Galante Airport"
1901,GBK,"Gbangbatok, Sierra Leone: Gbangbatok Airport"
1902,GBR,"Great Barrington, MA: Walter J. Koladza"
1903,GBU,"Khashm El Girba, Sudan: Khashm El Girba Airport"
1904,GCA,"Guacamayas, Colombia: Guacamayas Airport"
1905,GCC,"Gillette, WY: Gillette Campbell County"
1906,GCI,"Guernsey, United Kingdom: Guernsey Airport"
1907,GCK,"Garden City, KS: Garden City Regional"
1908,GCM,"Grand Cayman, Cayman Islands: Owen Roberts International"
1909,GCN,"Grand Canyon, AZ: Grand Canyon National Park"
1910,GCY,"Greeneville, TN: Municipal"
1911,GDC,"Greenville, SC: Donaldson Field"
1912,GDE,"Gode, Ethiopia: Gode Airport"
1913,GDH,"Golden Horn Lodge, AK: Golden Horn Lodge Seaplane Base"
1914,GDL,"Guadalajara, Mexico: Miguel Hidalgo Y Costilla International"
1915,GDM,"Gardner, MA: Gardner Municipal"
1916,GDN,"Gdansk, Poland: Gdansk Lech Walesa"
1917,GDQ,"Gondar, Ethiopia: Gondar Airport"
1918,GDT,"Grand Turk, Turks and Caicos Islands: JAGS McCartney International"
1919,GDV,"Glendive, MT: Dawson Community"
1920,GDW,"Gladwin, MI: Gladwin Zettel Memorial"
1921,GDX,"Magadan, Russia: Magadan Airport"
1922,GEA,"Noumea, New Caledonia: Noumea Magenta"
1923,GED,"Georgetown, DE: Delaware Coastal"
1924,GEG,"Spokane, WA: Spokane International"
1925,GEK,"Ganes Creek, AK: Ganes Creek Airport"
1926,GEL,"Santo Angelo, Brazil: Santo Angelo Airport"
1927,GEN,"Oslo, Norway: Gardermoen"
1928,GEO,"Georgetown, Guyana: Cheddi Jagan International"
1929,GER,"Nueva Gerona, Cuba: Rafael Cabrera"
1930,GES,"General Santos, Philippines: General Santos Airport"
1931,GET,"Geraldton, Australia: Geraldton Airport"
1932,GEV,"Gallivare, Sweden: Gallivare Airport"
1933,GEY,"Greybull, WY: South Big Horn County"
1934,GEZ,"Shelbyville, IN: Shelbyville Municipal"
1935,GFA,"Great Falls, MT: Malmstrom AFB Heliport"
1936,GFB,"Togiak Fish, AK: Togiak Fish Airport"
1937,GFF,"Griffith, Australia: Griffith Airport"
1938,GFK,"Grand Forks, ND: Grand Forks International"
1939,GFL,"Glens Falls, NY: Floyd Bennett Memorial"
1940,GFN,"Grafton, Australia: Grafton Airport"
1941,GFO,"Bartica, Guyana: Bartica Airport"
1942,GFR,"Granville, France: Granville Mont Saint Michel"
1943,GFY,"Grootfontein, Namibia: Grootfontein Airport"
1944,GGE,"Georgetown, SC: Georgetown County"
1945,GGG,"Longview, TX: East Texas Regional"
1946,GGN,"Gagnoa, Cote d'Ivoire: Gagnoa Airport"
1947,GGT,"Moss Town, The Bahamas: Exuma International"
1948,GGW,"Glasgow, MT: Wokal Field/Glasgow International"
1949,GHA,"Ghardaia, Algeria: Noumerat Moufdi Zakaria"
1950,GHB,"Governors Harbour, The Bahamas: Governors Harbour Airport"
1951,GHC,"Great Harbour Cay, The Bahamas: Great Harbour Cay Airport"
1952,GHT,"Ghat, Libya: Ghat Airport"
1953,GHU,"Gualeguaychu, Argentina: Gualeguaychu Airport"
1954,GIB,"Gibraltar, Gibraltar: Gibraltar Airport"
1955,GIG,"Rio de Janeiro, Brazil: Galeao-Antonio Carlos Jobim"
1956,GIL,"Gilgit, Pakistan: Gilgit Airport"
1957,GIS,"Gisborne, New Zealand: Gisborne Airport"
1958,GIZ,"Gizan, Saudi Arabia: Gizan Saudia Arabia"
1959,GJA,"Guanaja Island, Honduras: Guanaja"
1960,GJM,"Guajara-Mirim, Brazil: Guajara Mirim"
1961,GJT,"Grand Junction, CO: Grand Junction Regional"
1962,GKA,"Goroka, Papua New Guinea: Goroka Airport"
1963,GKL,"Great Keppel Island, Australia: Bonnie Doon"
1964,GKN,"Gulkana, AK: Gulkana Airport"
1965,GL1,"Station Nord, Greenland: Station Nord Airport"
1966,GL2,"Hyde Fjord, Greenland: Hyde Fjord Ice Strip"
1967,GLA,"Glasgow, United Kingdom: Glasgow Airport"
1968,GLD,"Goodland, KS: Renner Field"
1969,GLF,"Golfito, Costa Rica: Golfito Airport"
1970,GLH,"Greenville, MS: Greenville Mid Delta"
1971,GLI,"Glen Innes, Australia: Glen Innes Airport"
1972,GLK,"Galcaio, Somalia: Galcaio Airport"
1973,GLM,"Glenormiston, Australia: Glenormiston Airport"
1974,GLN,"Goulimime, Morocco: Goulimime Airport"
1975,GLO,"Gloucester/Cheltenham, United Kingdom: Gloucestershire"
1976,GLQ,"Glennallen, AK: Glennallen Airport"
1977,GLR,"Gaylord, MI: Gaylord Regional"
1978,GLS,"Galveston, TX: Scholes International at Galveston"
1979,GLT,"Gladstone, Australia: Gladstone Airport"
1980,GLV,"Golovin, AK: Golovin Airport"
1981,GLW,"Glasgow, KY: Glasgow Municipal"
1982,GMA,"Gemena, Congo (Kinshasa): Gemena Airport"
1983,GMB,"Gambella, Ethiopia: Gambella Airport"
1984,GMC,"Guerima, Colombia: Guerima Airport"
1985,GML,"Kiev, Ukraine: Antonov 2 International"
1986,GMP,"Seoul, South Korea: Gimpo International"
1987,GMT,"Granite Mountain, AK: Granite Mountain AS"
1988,GMU,"Greenville, SC: Greenville Downtown"
1989,GNA,"Hrodna, Belarus: Hrodna Airport"
1990,GNB,"Grenoble, France: Grenoble Isere"
1991,GND,"Grenada, Grenada: Maurice Bishop International"
1992,GNR,"General Roca, Argentina: General Roca Airport"
1993,GNU,"Goodnews Bay, AK: Goodnews"
1994,GNV,"Gainesville, FL: Gainesville Regional"
1995,GOA,"Genoa, Italy: Genova/Sestri"
1996,GOB,"Goba, Ethiopia: Goba Airport"
1997,GOH,"Nuuk, Greenland: Nuuk Airport"
1998,GOI,"Goa, India: Goa Airport"
1999,GOJ,"Nizhniy Novgorod, Russia: Nizhny Novgorod"
2000,GOL,"Gold Beach, OR: Gold Beach Municipal"
2001,GOM,"Goma, Congo (Kinshasa): Goma Airport"
2002,GON,"New London/Groton, CT: Groton-New London"
2003,GOO,"Goondiwindi, Australia: Goondiwindi Airport"
2004,GOP,"Gorakhpur, India: Gorakhpur Airport"
2005,GOR,"Gore, Ethiopia: Gore Airport"
2006,GOS,"Gosford, Australia: Gosford Airport"
2007,GOT,"Gothenburg, Sweden: Landvetter"
2008,GOU,"Garoua, Cameroon: Garoua Airport"
2009,GOV,"Gove, Australia: Gove Airport"
2010,GOZ,"Gorna Oryahovitsa, Bulgaria: Gorna Oryahovitsa Airport"
2011,GPI,"Guapi, Colombia: Guapi Airport"
2012,GPM,"Grand Prairie, TX: Grand Prairie Municipal"
2013,GPS,"Galapagos Islands, Ecuador: Baltra"
2014,GPT,"Gulfport/Biloxi, MS: Gulfport-Biloxi International"
2015,GPZ,"Grand Rapids, MN: Grand Rapids/Itasca County-Gordon Newstrom Field"
2016,GQQ,"Galion, OH: Horning"
2017,GRA,"Gamarra, Colombia: Germania"
2018,GRB,"Green Bay, WI: Austin Straubel International"
2019,GRD,"Greenwood, SC: Greenwood County"
2020,GRF,"Tacoma, WA: Gray AAF"
2021,GRI,"Grand Island, NE: Central Nebraska Regional"
2022,GRJ,"George, South Africa: George Airport"
2023,GRK,"Killeen, TX: Robert Gray AAF"
2024,GRO,"Gerona, Spain: Gerona Costa Brava"
2025,GRP,"Gurupi, Brazil: Gurupi Airport"
2026,GRQ,"Groningen, Netherlands: Eelde"
2027,GRR,"Grand Rapids, MI: Gerald R. Ford International"
2028,GRS,"Grosseto, Italy: Grosseto Airport"
2029,GRU,"Sao Paulo, Brazil: Guarulhos Gov Andre Franco Montoro"
2030,GRW,"Graciosa Island, Portugal: Graciosa Island Airport"
2031,GRX,"Granada, Spain: Granada Airport"
2032,GRZ,"Graz, Austria: Graz International"
2033,GSB,"Goldsboro, NC: Seymour Johnson AFB"
2034,GSE,"Gothenburg, Sweden: Gothenburg City"
2035,GSH,"Goshen, IN: Goshen Municipal"
2036,GSO,"Greensboro/High Point, NC: Piedmont Triad International"
2037,GSP,"Greer, SC: Greenville-Spartanburg International"
2038,GST,"Gustavus, AK: Gustavus Airport"
2039,GSW,"Dallas/Fort Worth, TX: Greater Southwest International"
2040,GT1,"San Jose, Guatemala: San Jose Airport"
2041,GTB,"Genting, Malaysia: Genting Airport"
2042,GTE,"Groote Island, Australia: Groote Eylandt"
2043,GTF,"Great Falls, MT: Great Falls International"
2044,GTK,"Sungei Tekai, Malaysia: Sungei Tekai Airport"
2045,GTN,"Mount Cook, New Zealand: Glentanner"
2046,GTO,"Gorontalo, Indonesia: Djalaluddin"
2047,GTR,"Columbus, MS: Golden Triangle Regional"
2048,GTU,"Georgetown, TX: Georgetown Municipal"
2049,GTW,"Zlin, Czech Republic: Holesov"
2050,GTY,"Gettysburg, PA: Gettysburg Regional"
2051,GUA,"Guatemala City, Guatemala: La Aurora International"
2052,GUB,"Guerrero Negro, Mexico: Guerrero Negro Airport"
2053,GUC,"Gunnison, CO: Gunnison-Crested Butte Regional"
2054,GUD,"Goundam, Mali: Goundam Airport"
2055,GUF,"Gulf Shores, AL: Jack Edwards"
2056,GUH,"Gunnedah, Australia: Gunnedah Airport"
2057,GUI,"Guiria, Venezuela: Guiria Airport"
2058,GUM,"Guam, TT: Guam International"
2059,GUO,"Gualaco, Honduras: Jicalapa"
2060,GUP,"Gallup, NM: Gallup Municipal"
2061,GUQ,"Guanare, Venezuela: Guanare Airport"
2062,GUR,"Alotau, Papua New Guinea: Gurney"
2063,GUS,"Peru, IN: Grissom ARB"
2064,GUT,"Gutersloh, Germany: Gutersloh Airport"
2065,GUW,"Atyrau, Kazakhstan: Atyrau Airport"
2066,GUY,"Guymon, OK: Guymon Municipal"
2067,GUZ,"Guiratinga, Brazil: Guiratinga Airport"
2068,GVA,"Geneva, Switzerland: Geneva Cointrin"
2069,GVE,"Gordonville, VA: Gordonsville Municipal"
2070,GVL,"Gainesville, GA: Lee Gilmer Memorial"
2071,GVQ,"Batavia, NY: Genesee County"
2072,GVR,"Governador Valadares, Brazil: Governador Valadares Airport"
2073,GVT,"Greenville, TX: Majors"
2074,GVW,"Grandview, MO: Richards/Gebaur AFB"
2075,GVX,"Gavle, Sweden: Gavle Airport"
2076,GWD,"Gwadar, Pakistan: Gwadar International"
2077,GWE,"Gweru, Zimbabwe: Gweru Thornhill"
2078,GWI,"Gwinner, ND: Gwinner Municipal"
2079,GWL,"Gwalior, India: Gwalior Airport"
2080,GWO,"Greenwood, MS: Greenwood/Leflore"
2081,GWR,"Gwinner, ND: Gwinner-Roger Melroe Field"
2082,GWS,"Glenwood Springs, CO: Glenwood Springs Municipal"
2083,GWT,"Westerland-Sylt, Germany: Sylt"
2084,GWY,"Galway, Ireland: Carnmore"
2085,GXF,"Sayun, Yemen: Sayun International"
2086,GXH,"Mildenhall, United Kingdom: Mildenhall NAF"
2087,GXQ,"Coyhaique, Chile: Teniente Vidal"
2088,GXX,"Yagoua, Cameroon: Yagoua Ville"
2089,GYA,"Guayaramerin, Bolivia: Guayaramerin Airport"
2090,GYD,"Baku, Azerbaijan: Heydar Aliyev International"
2091,GYE,"Guayaquil, Ecuador: Jose Joaquin de Olmedo International"
2092,GYM,"Guaymas, Mexico: General Jose Maria Yanez International"
2093,GYN,"Goiania, Brazil: Santa Genoveva"
2094,GYR,"Goodyear, AZ: Phoenix Goodyear"
2095,GYY,"Gary, IN: Gary/Chicago International"
2096,GZO,"Gizo, Solomon Islands: Gizo Airport"
2097,GZT,"Gaziantep, Turkey: Gaziantep Airport"
2098,HAB,"Hamilton, AL: Marion County"
2099,HAC,"Hachijo Jima Island, Japan: Hachijo Jima Island Airport"
2100,HAD,"Halmstad, Sweden: Halmstad Airport"
2101,HAE,"Havasupai, AZ: Havasupai Airport"
2102,HAF,"Half Moon Bay, CA: Half Moon Bay Airport"
2103,HAH,"Moroni, Comoros: Prince Said Ibrahim"
2104,HAJ,"Hannover, Germany: Hannover Airport"
2105,HAK,"Haikou, China: Meilan"
2106,HAM,"Hamburg, Germany: Hamburg Airport"
2107,HAN,"Hanoi, Vietnam: Noibai International"
2108,HAO,"Hamilton, OH: Butler County Regional Hogan Field"
2109,HAP,"Long Island, Australia: Long Island Airport"
2110,HAR,"Harrisburg, PA: Capital City"
2111,HAS,"Hail, Saudi Arabia: Hail Airport"
2112,HAU,"Haugesund, Norway: Karmoy"
2113,HAV,"Havana, Cuba: Jose Marti International"
2114,HAY,"Haycock, AK: Haycock Airport"
2115,HBA,"Hobart, Australia: Hobart Airport"
2116,HBC,"Hanus Bay, AK: Hanus Bay Airport"
2117,HBE,"Alexandria, Egypt: Borg El Arab"
2118,HBG,"Hattiesburg, MS: Hattiesburg Bobby L. Chain Municipal"
2119,HBH,"Hobart Bay, AK: Hobart Bay Airport"
2120,HBI,"Harbour Island, The Bahamas: Harbour Island Airport"
2121,HBL,"Babelegi, South Africa: Babelegi Heliport"
2122,HBT,"Hafr Al Batin, Saudi Arabia: Al Batin"
2123,HBV,"Hebbronville, TX: Jim Hogg County"
2124,HBY,"Hood Bay, AK: Hood Bay Airport"
2125,HCA,"Big Spring, TX: Howard County"
2126,HCB,"Shoal Cove, AK: Shoal Cove Airport"
2127,HCR,"Holy Cross, AK: Holy Cross Airport"
2128,HCW,"Cheraw, SC: Cheraw Municipal/Lynch Bellinger Field"
2129,HDA,"Hidden Falls, AK: Hidden Falls Airport"
2130,HDB,"Heidelberg, Germany: Heidelberg AHP"
2131,HDD,"Hyderabad, Pakistan: Hyderabad Airport"
