,Code,Description
4791,SDT,"Saidu Sharif, Pakistan: Saidu Sharif Airport"
4792,SDU,"Rio de Janeiro, Brazil: Santos Dumont"
4793,SDV,"Tel Aviv, Israel: Sde Dov"
4794,SDX,"Sedona, AZ: Sedona Airport"
4795,SDY,"Sidney, MT: Sidney/Richland Municipal"
4796,SE1,"Solleftea, Sweden: Solleftea Airport"
4797,SEA,"Seattle, WA: Seattle/Tacoma International"
4798,SEB,"Sebha, Libya: Sebha Airport"
4799,SEE,"San Diego, CA: Gillespie Field"
4800,SEF,"Sebring, FL: Sebring Regional"
4801,SEG,"Selinsgrove, PA: Penn Valley"
4802,SEL,"Seoul, South Korea: Kimpo International/Seoul Metropolitan Area"
4803,SEM,"Selma, AL: Craig Field"
4804,SEN,"Southend-On-Sea, United Kingdom: Southend"
4805,SEQ,"Sungai Pakning, Indonesia: Sungai Pakning Airport"
4806,SER,"Seymour, IN: Freeman Municipal"
4807,SES,"Selma, AL: Selfield"
4808,SEY,"Selibaby, Mauritania: Selibabi"
4809,SEZ,"Mahe Islands, Seychelles: Seychelles International"
4810,SFA,"Sfax, Tunisia: El Maou"
4811,SFB,"Sanford, FL: Orlando Sanford International"
4812,SFC,"Saint Francois, Guadeloupe: Saint Francois Airport"
4813,SFD,"San Fernando, Venezuela: San Fernando de Apure"
4814,SFF,"Spokane, WA: Felts Field"
4815,SFG,"Grand Case, Saint Martin: L'Esperance"
4816,SFH,"San Felipe, Mexico: San Felipe International"
4817,SFJ,"Sondre Stromfjord, Greenland: Sondrestrom Air Base"
4818,SFL,"Sao Filipe, Cape Verde: Sao Filipe Airport"
4819,SFM,"Sanford, ME: Sanford Seacoast Regional"
4820,SFN,"Santa Fe, Argentina: Sauce Viejo"
4821,SFO,"San Francisco, CA: San Francisco International"
4822,SFP,"Surfers Paradise, Australia: Surfers Paradise Airport"
4823,SFQ,"Sanliurfa, Turkey: Sanliurfa Airport"
4824,SFS,"Subic Bay, Philippines: Subic Bay International"
4825,SFT,"Skelleftea, Sweden: Skelleftea Airport"
4826,SFU,"Safia, Papua New Guinea: Safia Airport"
4827,SFW,"Santa Fe, Panama: Santa Fe Airport"
4828,SFZ,"Smithfield, RI: North Central State"
4829,SGB,"Singaua, Papua New Guinea: Singaua Airport"
4830,SGC,"Surgut, Russia: Surgut Airport"
4831,SGD,"Sonderborg, Denmark: Sonderborg Airport"
4832,SGE,"Siegen, Germany: Siegerland"
4833,SGF,"Springfield, MO: Springfield-Branson National"
4834,SGG,"Simanggang, Malaysia: Simanggang Airport"
4835,SGH,"Springfield, OH: Springfield-Beckley Municipal"
4836,SGJ,"Sagarai, Papua New Guinea: Sagarai Airport"
4837,SGM,"San Ignacio, Mexico: San Ignacio Airport"
4838,SGN,"Ho Chi Minh City, Vietnam: Tan Son Nhat International"
4839,SGO,"St. George, Australia: Saint George"
4840,SGP,"Shay Gap, Australia: Shay Gap Airport"
4841,SGR,"Sugar Land, TX: Sugar Land Regional"
4842,SGT,"Stuttgart, AR: Stuttgart Municipal"
4843,SGU,"St. George, UT: St George Regional"
4844,SGW,"Saginaw Bay, AK: Saginaw"
4845,SGX,"Songea, Tanzania: Songea Airport"
4846,SGY,"Skagway, AK: Skagway Airport"
4847,SGZ,"Singora, Thailand: Songkhla"
4848,SHA,"Shanghai, China: Hongqiao International"
4849,SHB,"Nakashibetsu, Japan: Nakashibetsu Airport"
4850,SHC,"Shire Indasilase, Ethiopia: Shire"
4851,SHD,"Staunton, VA: Shenandoah Valley Regional"
4852,SHE,"Shenyang, China: Taoxian"
4853,SHG,"Shungnak, AK: Shungnak Airport"
4854,SHH,"Shishmaref, AK: Shishmaref Airport"
4855,SHI,"Shimojishima, Japan: Shimojishima Airport"
4856,SHJ,"Sharjah, United Arab Emirates: Sharjah International"
4857,SHL,"Shillong, India: Barapani"
4858,SHM,"Nanki Shirahama, Japan: Nanki Shirahama Airport"
4859,SHN,"Shelton, WA: Sanderson Field"
4860,SHO,"Sokcho, South Korea: G 407"
4861,SHR,"Sheridan, WY: Sheridan County"
4862,SHU,"Smith Point, Australia: Smith Point Airport"
4863,SHV,"Shreveport, LA: Shreveport Regional"
4864,SHW,"Sharurah, Saudi Arabia: Sharurah Airport"
4865,SHX,"Shageluk, AK: Shageluk Airport"
4866,SIA,"Xi'an, China: Xi'an Xiguan"
4867,SID,"Sal Island, Cape Verde: Amilcar Cabral International"
4868,SIG,"San Juan, PR: Isla Grande"
4869,SIH,"Silgadi Doti, Nepal: Silgadi Doti Airport"
4870,SII,"Sidi Ifni, Morocco: Sidi Ifni Airport"
4871,SIK,"Sikeston, MO: Sikeston Memorial Municipal"
4872,SIM,"Simbai, Papua New Guinea: Simbai Airport"
4873,SIN,"Singapore, Singapore: Singapore Changi International"
4874,SIO,"Smithton, Australia: Smithton Airport"
4875,SIP,"Simferopol, Ukraine: Simferopol International"
4876,SIR,"Sion, Switzerland: Sion Airport"
4877,SIS,"Sishen, South Africa: Sishen Airport"
4878,SIT,"Sitka, AK: Sitka Rocky Gutierrez"
4879,SIU,"Siuna, Nicaragua: Siuna Airport"
4880,SIY,"Montague, CA: Siskiyou County"
4881,SJC,"San Jose, CA: Norman Y. Mineta San Jose International"
4882,SJD,"San Jose del Cabo, Mexico: Los Cabos International"
4883,SJF,"St. John, VI: St. John Airport"
4884,SJI,"San Jose, Philippines: San Jose Airport"
4885,SJJ,"Sarajevo, Bosnia and Herzegovina: Sarajevo Airport"
4886,SJK,"Sao Jose Dos Campos, Brazil: Professor Urbano Ernesto Stumpf"
4887,SJN,"St. Johns, AZ: St. Johns Industrial Air Park"
4888,SJO,"San Jose, Costa Rica: Juan Santamaria International"
4889,SJP,"Sao Jose Do Rio Preto, Brazil: Sao Jose Do Rio Preto Airport"
4890,SJQ,"Sesheke, Zambia: Sesheke Airport"
4891,SJS,"San Jose, Bolivia: San Jose de Chiquitos"
4892,SJT,"San Angelo, TX: San Angelo Regional/Mathis Field"
4893,SJU,"San Juan, PR: Luis Munoz Marin International"
4894,SJV,"San Javier, Bolivia: San Javier Airport"
4895,SJW,"Shijiazhuang, China: Zhengding"
4896,SJY,"Seinajoki, Finland: Seinajoki Airport"
4897,SJZ,"Sao Jorge Island, Portugal: Sao Jorge"
4898,SKA,"Spokane, WA: Fairchild AFB"
4899,SKB,"St. Kitts, Saint Kitts and Nevis: Robert L. Bradshaw International"
4900,SKC,"Suki, Papua New Guinea: Suki Airport"
4901,SKD,"Samarkand, Uzbekistan: Samarkand Airport"
4902,SKE,"Skien, Norway: Geiteryggen"
4903,SKF,"San Antonio, TX: Kelly Field"
4904,SKG,"Thessaloniki, Greece: Makedonia"
4905,SKJ,"Sitkinak, AK: Sitkinak CGS"
4906,SKK,"Shaktoolik, AK: Shaktoolik Airport"
4907,SKL,"Isle of Skye, United Kingdom: Isle of Skye Airport"
4908,SKN,"Stokmarknes, Norway: Skagen"
4909,SKO,"Sokoto, Nigeria: Sokoto Airport"
4910,SKP,"Skopje, Macedonia: Skopje Airport"
4911,SKS,"Skrydstrup, Denmark: Skrydstrup Airport"
4912,SKT,"Sialkot, Pakistan: Sialkot International"
4913,SKU,"Skiros, Greece: Skiros Airport"
4914,SKW,"Skwentna, AK: Skwentna Airport"
4915,SKX,"Saransk, Russia: Saransk Airport"
4916,SKY,"Sandusky, OH: Griffing Sandusky"
4917,SKZ,"Sukkur, Pakistan: Begum Nusrat Bhutto"
4918,SLA,"Salta, Argentina: Salta Airport"
4919,SLB,"Storm Lake, IA: Storm Lake Municipal"
4920,SLC,"Salt Lake City, UT: Salt Lake City International"
4921,SLD,"Sliac, Slovakia: Sliac International"
4922,SLE,"Salem, OR: McNary Field"
4923,SLH,"Sola, Vanuatu: Sola Airport"
4924,SLI,"Solwezi, Zambia: Solwezi Airport"
4925,SLJ,"Chandler, AZ: Stellar Airpark"
4926,SLK,"Saranac Lake/Lake Placid, NY: Adirondack Regional"
4927,SLL,"Salalah, Oman: Salalah Airport"
4928,SLM,"Salamanca, Spain: Matacan"
4929,SLN,"Salina, KS: Salina Regional"
4930,SLO,"Salem, IL: Salem/Leckrone"
4931,SLP,"San Luis Potosi, Mexico: Ponciano Arriaga International"
4932,SLQ,"Sleetmute, AK: Sleetmute Airport"
4933,SLR,"Sulphur Springs, TX: Sulphur Springs Municipal"
4934,SLS,"Silistra, Bulgaria: Silistra Polkovnik-Lambrinovo"
4935,SLT,"Salida, CO: Harriet Alexander Field"
4936,SLU,"St. Lucia, Saint Lucia: George F. Charles"
4937,SLV,"Shimla, India: Shimla Airport"
4938,SLW,"Saltillo, Mexico: Plan de Guadalupe International"
4939,SLX,"Salt Cay, Turks and Caicos Islands: Salt Cay Airport"
4940,SLZ,"Sao Luiz, Brazil: Marechal Cunha Machado International"
4941,SMA,"Santa Maria, Portugal: Santa Maria Airport"
4942,SMB,"Cerro El Sombrero, Chile: Franco Bianco"
4943,SMC,"Santa Maria, Colombia: Santa Maria Airport"
4944,SME,"Somerset, KY: Lake Cumberland Regional"
4945,SMF,"Sacramento, CA: Sacramento International"
4946,SMI,"Samos, Greece: Samos Airport"
4947,SMK,"St. Michael, AK: St. Michael Airport"
4948,SML,"Stella Maris, The Bahamas: Estate Airstrip"
4949,SMN,"Salmon, ID: Lemhi County"
4950,SMO,"Santa Monica, CA: Santa Monica Municipal"
4951,SMQ,"Sampit, Indonesia: H.Asan"
4952,SMR,"Santa Marta, Colombia: Simon Bolivar"
4953,SMS,"St. Marie, Madagascar: Sainte Marie"
4954,SMT,"Stone Mountain, GA: Stone Mountain Airport"
4955,SMU,"Sheep Mountain, AK: Sheep Mountain Airport"
4956,SMV,"St. Moritz, Switzerland: Samedan"
4957,SMX,"Santa Maria, CA: Santa Maria Public/Capt. G. Allan Hancock Field"
4958,SMY,"Simenti, Senegal: Simenti Airport"
4959,SMZ,"Stoelmanseiland, Suriname: Stoelmanseiland Airport"
4960,SNA,"Santa Ana, CA: John Wayne Airport-Orange County"
4961,SNB,"Snake Bay, Australia: Snake Bay Airport"
4962,SNC,"Salinas, Ecuador: General Ulpiano Paez"
4963,SNE,"Sao Nicolau, Cape Verde: Preguica"
4964,SNF,"San Felipe, Venezuela: Sub Teniente Nestor Arias"
4965,SNG,"San Ignacio de Velasco, Bolivia: Cap. Av. Juan Cochamanidis Saucedo"
4966,SNI,"Greenville/Sinoe, Liberia: Greenville/Sinoe Airport"
4967,SNK,"Snyder, TX: Winston Field"
4968,SNL,"Shawnee, OK: Shawnee Regional"
4969,SNM,"San Ignacio de Moxos, Bolivia: San Ignacio de Moxos Airport"
4970,SNN,"Shannon, Ireland: Shannon Airport"
4971,SNP,"St. Paul, AK: St. Paul Island"
4972,SNQ,"San Quintin, Mexico: San Quintin Southeast"
4973,SNR,"St. Nazaire, France: Saint Nazaire Montoir"
4974,SNS,"Salinas/Monterey, CA: Salinas Municipal"
4975,SNT,"Las Cruces, Colombia: Las Cruces Airport"
4976,SNU,"Santa Clara, Cuba: Abel Santamaria"
4977,SNV,"Santa Elena, Venezuela: Wonkin"
4978,SNW,"Thandwe, Burma: Thandwe Airport"
4979,SNY,"Sidney, NE: Sidney Municipal/Lloyd W. Carr Field"
4980,SOB,"Sarmellek, Hungary: Balaton"
4981,SOC,"Solo City, Indonesia: Adi Soemarmo International"
4982,SOF,"Sofia, Bulgaria: Sofia Airport"
4983,SOG,"Sogndal, Norway: Haukasen"
4984,SOI,"South Molle Island, Australia: S Molle"
4985,SOJ,"Sorkjosen, Norway: Sorkjosen Airport"
4986,SOK,"Semonkong, Lesotho: Semonkong Airport"
4987,SOL,"Solomon, AK: Solomon State Field"
4988,SOM,"San Tome, Venezuela: San Tome Airport"
4989,SON,"Espiritu Santo, Vanuatu: Espiritu"
4990,SOP,"Pinehurst/Southern Pines, NC: Moore County"
4991,SOQ,"Sorong, Indonesia: Sorong Airport"
4992,SOU,"Southampton, United Kingdom: Southampton Airport"
4993,SOV,"Seldovia, AK: Seldovia Airport"
4994,SOW,"Show Low, AZ: Show Low Regional"
4995,SPA,"Spartanburg, SC: Spartanburg Downtown Memorial"
4996,SPB,"Charlotte Amalie, VI: Charlotte Amalie Harbor Seaplane Base"
4997,SPC,"Santa Cruz de la Palma, Spain: La Palma"
4998,SPD,"Saidpur, Bangladesh: Saidpur Airport"
4999,SPE,"Sepulot, Malaysia: Sepulot Airport"
5000,SPF,"Spearfish, SD: Black Hills Clyde Ice Field"
5001,SPG,"Tampa, FL: Albert Whitted"
5002,SPH,"Sopu, Papua New Guinea: Sopu Airport"
5003,SPI,"Springfield, IL: Abraham Lincoln Capital"
5004,SPK,"Sapporo, Japan: Chitose AB"
5005,SPM,"Spangdahlem, Germany: Spangdahlem AB"
5006,SPN,"Saipan, TT: Francisco C. Ada Saipan International"
5007,SPP,"Menongue, Angola: Menongue Airport"
5008,SPQ,"San Pedro, CA: Catalina Air-Sea Terminal Heliport"
5009,SPR,"San Pedro, Belize: San Pedro Airport"
5010,SPS,"Wichita Falls, TX: Sheppard AFB/Wichita Falls Municipal"
5011,SPU,"Split, Croatia: Split Airport"
5012,SPW,"Spencer, IA: Spencer Municipal"
5013,SPY,"San Pedro, Cote d'Ivoire: San Pedro Airport"
5014,SPZ,"Springdale, AR: Springdale Municipal"
5015,SQA,"Santa Ynez, CA: Santa Ynez Airport"
5016,SQI,"Sterling/Rockfalls, IL: Whiteside County-Jos H. Bittorf Field"
5017,SQL,"San Carlos, CA: San Carlos Airport"
5018,SQN,"Sanana, Indonesia: Emalamo"
5019,SQO,"Storuman, Sweden: Storuman Airport"
5020,SQQ,"Siauliai, Lithuania: Siauliai International"
5021,SQR,"Soroako, Indonesia: Soroako Airport"
5022,SQV,"Sequim, WA: Sequim Valley"
5023,SRA,"Santa Rosa, Brazil: Santa Rosa Airport"
5024,SRB,"Santa Rosa, Bolivia: Santa Rosa Airport"
5025,SRC,"Searcy, AR: Searcy Municipal"
5026,SRE,"Sucre, Bolivia: Juana Azurduy de Padilla"
5027,SRF,"Novato, CA: Hamilton AFB"
5028,SRG,"Semarang, Indonesia: Ahmad Yani"
5029,SRH,"Sarh, Chad: Sarh Airport"
5030,SRI,"Samarinda, Indonesia: Samarinda Airport"
5031,SRJ,"San Borja, Bolivia: Capitan German Quiroga Guardia"
5032,SRL,"Santa Rosalia, Mexico: San Lucas"
5033,SRN,"Strahan, Australia: Strahan Airport"
5034,SRO,"Santana Ramos, Colombia: Santana Ramos Airport"
5035,SRP,"Stord, Norway: Stord Airport"
5036,SRQ,"Sarasota/Bradenton, FL: Sarasota/Bradenton International"
5037,SRV,"Stony River, AK: Stony River Airport"
5038,SRW,"Salisbury, NC: Rowan County"
5039,SRX,"Sert, Libya: Sirte International"
5040,SRZ,"Santa Cruz, Bolivia: El Trompillo"
5041,SSA,"Salvador, Brazil: Deputado Luis Eduardo Magalhaes International"
5042,SSB,"Christiansted, VI: Christiansted Harbor Seaplane Base"
5043,SSC,"Sumter, SC: Shaw AFB"
5044,SSG,"Malabo, Equatorial Guinea: Malabo Airport"
5045,SSH,"Sharm El Sheikh, Egypt: Sharm El Sheikh International"
5046,SSI,"Brunswick, GA: McKinnon St Simons Island"
5047,SSJ,"Sandnessjoen, Norway: Stokka"
5048,SSL,"Santa Rosalia, Colombia: Santa Rosalia Airport"
5049,SSM,"Sault Ste. Marie, MI: Sault Ste. Marie Metropolitan Area"
5050,SSN,"Seoul, South Korea: Seoul AB"
5051,SSS,"Siassi, Papua New Guinea: Siassi Airport"
5052,SST,"Santa Teresita, Argentina: Santa Teresita Airport"
5053,SSW,"Stuart Island, WA: Stuart Island Airpark"
5054,SSX,"Samsun, Turkey: Samsun Airport"
5055,SSY,"Mbanza Congo, Angola: Mbanza Congo Airport"
5056,STA,"Stauning, Denmark: Stauning Airport"
5057,STB,"Santa Barbara, Venezuela: Santa Barbara Airport"
5058,STC,"St. Cloud, MN: St. Cloud Regional"
5059,STD,"Santo Domingo, Venezuela: Mayor Guerrero Vivas"
5060,STE,"Stevens Point, WI: Stevens Point Municipal"
5061,STF,"Starkville, MS: George M. Bryan"
5062,STG,"St. George Island, AK: St. George Island Airport"
5063,STI,"Santiago, Dominican Republic: Cibao International"
5064,STJ,"St. Joseph, MO: Rosecrans Memorial"
5065,STK,"Sterling, CO: Sterling Municipal"
5066,STL,"St. Louis, MO: Lambert-St. Louis International"
5067,STM,"Santarem, Brazil: Eduardo Gomes"
5068,STN,"London, United Kingdom: London Stansted"
5069,STO,"Stockholm, Sweden: Stockholm Metropolitan Area"
5070,STP,"Minneapolis/St. Paul, MN: St. Paul Downtown Holman Field"
5071,STQ,"St. Marys, PA: St. Marys Municipal"
5072,STR,"Stuttgart, Germany: Stuttgart Airport"
5073,STS,"Santa Rosa, CA: Charles M. Schulz - Sonoma County"
5074,STT,"Charlotte Amalie, VI: Cyril E King"
5075,STW,"Stavropol, Russia: Shpakovskoye"
5076,STX,"Christiansted, VI: Henry E. Rohlsen"
5077,STY,"Salto, Uruguay: Nueva Hesperides International"
5078,STZ,"Santa Terezinha, Brazil: Santa Terezinha Airport"
5079,SUA,"Stuart, FL: Witham Field"
5080,SUB,"Surabaya, Indonesia: Juanda"
5081,SUC,"Sundance, WY: Schloredt"
5082,SUE,"Sturgeon Bay, WI: Door County Cherryland"
5083,SUF,"Lamezia Terme, Italy: Lamezia Terme Airport"
5084,SUG,"Surigao, Philippines: Surigao Airport"
5085,SUI,"Sukhumi, Georgia: Babusheri"
5086,SUJ,"Satu Mare, Romania: Satu Mare Airport"
5087,SUL,"Sui, Pakistan: Sui Airport"
5088,SUM,"Sumter, SC: Sumter Airport"
5089,SUN,"Sun Valley/Hailey/Ketchum, ID: Friedman Memorial"
5090,SUO,"Sunriver, OR: Sunriver Airport"
5091,SUS,"St. Louis, MO: Spirit of St. Louis"
5092,SUT,"Sumbawanga, Tanzania: Sumbawanga Airport"
5093,SUU,"Fairfield, CA: Travis AFB"
5094,SUV,"Suva, Fiji: Nausori International"
5095,SUW,"Superior, WI: Richard I Bong"
5096,SUX,"Sioux City, IA: Sioux Gateway/Col. Bud Day Field"
5097,SVA,"Savoonga, AK: Savoonga Airport"
5098,SVB,"Sambava, Madagascar: Sambava Airport"
5099,SVC,"Silver City/Hurley, NM: Grant County"
5100,SVD,"St. Vincent, Saint Vincent and the Grenadines: E. T. Joshua"
5101,SVG,"Stavanger, Norway: Sola"
5102,SVH,"Statesville, NC: Statesville Regional"
5103,SVJ,"Svolvaer, Norway: Helle"
5104,SVL,"Savonlinna, Finland: Savonlinna Airport"
5105,SVN,"Savannah, GA: Hunter AAF"
5106,SVO,"Moscow, Russia: Sheremetyevo"
5107,SVP,"Kuito, Angola: Kuito Airport"
5108,SVQ,"Seville, Spain: Seville Airport"
5109,SVS,"Stevens Village, AK: Stevens Village Airport"
5110,SVU,"Savusavu, Fiji: Savusavu Airport"
5111,SVW,"Sparrevohn, AK: Sparrevohn LRRS"
5112,SVX,"Ekaterinburg, Russia: Koltsovo"
5113,SVZ,"San Antonio, Venezuela: San Antonio del Tachira"
5114,SWA,"Shantou, China: Waisha"
5115,SWB,"Shaw River, Australia: Shaw River Airport"
5116,SWC,"Stawell, Australia: Stawell Airport"
5117,SWD,"Seward, AK: Seward Airport"
5118,SWF,"Newburgh/Poughkeepsie, NY: Stewart International"
5119,SWI,"Swindon, United Kingdom: Swindon Airport"
5120,SWK,"Milan, Italy: Segrate"
5121,SWL,"Spanish Wells, The Bahamas: Spanish Wells Airport"
5122,SWO,"Stillwater, OK: Stillwater Regional"
5123,SWQ,"Sumbawa, Indonesia: Sumbawa Besar"
5124,SWS,"Swansea, United Kingdom: Swansea Airport"
5125,SWU,"Suwon, South Korea: Suwon Airport"
5126,SWW,"Sweetwater, TX: Avenger Field"
5127,SXB,"Strasbourg, France: Strasbourg Entzheim"
5128,SXE,"Sale, Australia: West Sale"
5129,SXF,"Berlin, Germany: Schonefeld"
5130,SXG,"Senanga, Zambia: Senanga Airport"
5131,SXL,"Sligo, Ireland: Sligo Airport"
5132,SXM,"Philipsburg, Sint Maarten: Princess Juliana International"
5133,SXP,"Sheldon Point, AK: Sheldon Point Airport"
5134,SXQ,"Soldotna, AK: Soldotna Airport"
5135,SXR,"Srinagar, India: Srinagar Airport"
5136,SXU,"Soddu, Ethiopia: Soddu Airport"
5137,SXY,"Sidney, NY: Sidney Municipal"
5138,SYA,"Shemya, AK: Eareckson AS"
5139,SYB,"Seal Bay, AK: Seal Bay Airport"
5140,SYD,"Sydney, Australia: Sydney International"
5141,SYI,"Shelbyville/Tullahoma, TN: Bomar Field-Shelbyville Municipal"
5142,SYN,"Stanton, MN: Stanton Airport"
5143,SYO,"Shonai, Japan: Shonai Airport"
5144,SYR,"Syracuse, NY: Syracuse Hancock International"
5145,SYT,"Saint-Yan, France: Saint-Yan Airport"
5146,SYX,"Sanya, China: Phoenix International"
5147,SYY,"Stornoway, United Kingdom: Stornoway Airport"
5148,SYZ,"Shiraz, Iran: Shahid Dastghaib International"
5149,SZA,"Soyo, Angola: Soyo Airport"
5150,SZB,"Kuala Lumpur, Malaysia: Sultan Abdul Aziz Shah International"
5151,SZC,"Santa Cruz, Costa Rica: Santa Cruz Airport"
5152,SZD,"Sheffield, United Kingdom: Sheffield City"
5153,SZF,"Samsun, Turkey: Carsamba"
5154,SZG,"Salzburg, Austria: Salzburg Airport"
5155,SZK,"Skukuza, South Africa: Skukuza Airport"
5156,SZL,"Knob Noster, MO: Whiteman AFB"
5157,SZO,"Szombathely, Hungary: Szombathely Airport"
5158,SZP,"Santa Paula, CA: Santa Paula Airport"
5159,SZT,"San Cristobal, Mexico: San Cristobal de Las Casas"
5160,SZW,"Schwerin, Germany: Schwerin Parchim"
5161,SZX,"Shenzhen, China: Bao'an International"
5162,SZZ,"Szczecin, Poland: Goleniow"
5163,T1X,"Gainesville, TX: Gainesville Municipal"
5164,T2X,"Hereford, TX: Hereford Municipal"
5165,T3X,"Encino, TX: El Coyote Ranch"
5166,T4X,"Austin, TX: Austin Executive Airpark"
5167,TAB,"Tobago, Trinidad and Tobago: A.N.R. Robinson International"
5168,TAC,"Tacloban, Philippines: Daniel Z. Romualdez"
5169,TAD,"Trinidad, CO: Las Animas County"
5170,TAE,"Taegu, South Korea: Taegu International"
5171,TAF,"Oran, Algeria: Tafaraoui"
5172,TAG,"Tagbilaran, Philippines: Tagbilaran Airport"
5173,TAH,"Tanna Island, Vanuatu: Tanna Island Airport"
5174,TAI,"Taiz, Yemen: Taiz International"
5175,TAK,"Takamatsu, Japan: Takamatsu Airport"
5176,TAL,"Tanana, AK: Ralph M Calhoun Memorial"
5177,TAM,"Tampico, Mexico: General Francisco Javier Mina International"
5178,TAO,"Qingdao, China: Liuting"
5179,TAP,"Tapachula, Mexico: Tapachula International"
5180,TAR,"Taranto, Italy: Taranto Grottaglie"
5181,TAS,"Tashkent, Uzbekistan: Tashkent Yuzhny"
5182,TAT,"Poprad-Tatry, Slovakia: Poprad-Tatry International"
5183,TAV,"Tau, TT: Tau Airport"
5184,TAX,"Taliabu, Indonesia: Taliabu Airport"
5185,TBB,"Tuy Hoa, Vietnam: Tuy Hoa Airport"
5186,TBF,"Tabiteuea, Kiribati: Tabiteuea Airport"
5187,TBG,"Tabubil, Papua New Guinea: Tabubil Airport"
5188,TBI,"New Bight, The Bahamas: The Bight"
5189,TBL,"Tableland, Australia: Tableland Airport"
5190,TBN,"Fort Leonard Wood, MO: Waynesville-St. Robert Regional Forney Field"
5191,TBO,"Tabora, Tanzania: Tabora Airport"
5192,TBP,"Tumbes, Peru: Cap. FAP Pedro Canga Rodriguez"
5193,TBR,"Statesboro, GA: Statesboro-Bulloch County"
5194,TBS,"Tbilisi, Georgia: Tbilisi Airport"
5195,TBT,"Tabatinga, Brazil: Tabatinga Airport"
5196,TBU,"Tonga Tapu, Tonga: Fua Amotu International"
5197,TBZ,"Tabriz, Iran: Tabriz International"
5198,TCA,"Tennant Creek, Australia: Tennant Creek Airport"
5199,TCB,"Treasure Cay, The Bahamas: Treasure Cay Airport"
5200,TCC,"Tucumcari, NM: Tucumcari Municipal"
5201,TCE,"Tulcea, Romania: Delta Dunarii"
5202,TCF,"Tocoa, Honduras: Tocoa Airport"
5203,TCH,"Tchibanga, Gabon: Tchibanga Airport"
5204,TCI,"Tenerife, Spain: Tenerife Metropolitan Area"
5205,TCL,"Tuscaloosa, AL: Tuscaloosa Regional"
5206,TCM,"Tacoma, WA: McChord Field"
5207,TCN,"Tehuacan, Mexico: Tehuacan Airport"
5208,TCO,"Tumaco, Colombia: La Florida"
5209,TCP,"Taba, Egypt: Taba International"
5210,TCQ,"Tacna, Peru: Coronel Carlos Ciriani Santa Rosa International"
5211,TCS,"Truth Or Consequences, NM: Truth Or Consequences Municipal"
5212,TCT,"Takotna, AK: Takotna Airport"
5213,TDA,"Trinidad, Colombia: San Luis de Palenque"
5214,TDD,"Trinidad, Bolivia: Tte Av Jorge Henrich Arauz International"
5215,TDF,"Roxboro, NC: Person County"
5216,TDW,"Amarillo, TX: Tradewind"
5217,TDZ,"Toledo, OH: Metcalf Field"
5218,TEA,"Tela, Honduras: Tela Airport"
5219,TEB,"Teterboro, NJ: Teterboro Airport"
5220,TED,"Thisted, Denmark: Thisted Airport"
5221,TEH,"Tetlin, AK: Tetlin Airport"
5222,TEK,"Tatitlek, AK: Tatitlek Airport"
5223,TEP,"Teptep, Papua New Guinea: Teptep Airport"
5224,TER,"Lajes, Portugal: Lajes Airport"
5225,TET,"Tete, Mozambique: Tete Chingodzi"
5226,TEU,"Te Anau, New Zealand: Te Anau Airport"
5227,TEX,"Telluride, CO: Telluride Regional"
5228,TEZ,"Tezpur, India: Tezpur Airport"
5229,TFF,"Tefe, Brazil: Tefe Airport"
5230,TFI,"Tufi, Papua New Guinea: Tufi Airport"
5231,TFN,"Tenerife, Spain: Tenerife Norte"
5232,TFR,"Tarbes/Lourdes/Pyrenees, France: Tarbes-Lourdes-Pyrenees"
5233,TFS,"Tenerife, Spain: Tenerife Sur"
5234,TGD,"Podgorica, Montenegro: Podgorica Airport"
5235,TGE,"Tuskegee, AL: Sharpe Field"
5236,TGG,"Kuala Trengganu, Malaysia: Kuala Trengganu Airport"
5237,TGH,"Tongoa, Vanuatu: Tongoa Airport"
5238,TGI,"Tingo Maria, Peru: Tingo Maria Airport"
5239,TGM,"Targu Mures, Romania: Transilvania Targu Mures"
5240,TGR,"Touggourt, Algeria: Touggourt/Sidi Mahdi"
5241,TGT,"Tanga, Tanzania: Tanga Airport"
5242,TGU,"Tegucigalpa, Honduras: Toncontin International"
5243,TGZ,"Tuxtla Gutierrez, Mexico: Angel Albino Corzo"
5244,THA,"Tullahoma, TN: Tullahoma Regional Airport/William Northern Field"
5245,THE,"Teresina, Brazil: Senador Petronio Portella"
5246,THF,"Berlin, Germany: Tempelhof"
5247,THG,"Biloela, Australia: Biloela (Thangool)"
5248,THN,"Trollhattan, Sweden: Trollhattan Vanersborg"
5249,THP,"Thermopolis, WY: Hot Springs County Thermopolis Municipal"
5250,THR,"Tehran, Iran: Mehrabad International"
5251,THU,"Thule, Greenland: Thule Air Base"
5252,THV,"York, PA: York Airport"
5253,THZ,"Tahoua, Niger: Tahoua Airport"
5254,TIA,"Tirana, Albania: Tirana International"
5255,TIC,"Tinak, Marshall Islands: Tinak Airport"
5256,TIE,"Tippi, Ethiopia: Tippi Airport"
5257,TIF,"Taif, Saudi Arabia: Taif Airport"
5258,TIH,"Tikehau, French Polynesia: Tikehau Airport"
5259,TIJ,"Tijuana, Mexico: General Abelardo L. Rodriguez International"
5260,TIK,"Oklahoma City, OK: Tinker AFB"
5261,TIM,"Tembagapura, Indonesia: Moses Kilangin"
5262,TIN,"Tindouf, Algeria: Tindouf Airport"
5263,TIP,"Tripoli, Libya: Tripoli International"
5264,TIQ,"Tinian, TT: Tinian International"
5265,TIR,"Tirupati, India: Tirupati Airport"
5266,TIS,"Thursday Island, Australia: Horn Island"
5267,TIU,"Timaru, New Zealand: Timaru Airport"
5268,TIV,"Tivat, Montenegro: Tivat Airport"
5269,TIW,"Tacoma, WA: Tacoma Narrows"
5270,TIX,"Titusville, FL: Space Coast Regional"
5271,TIY,"Tidjikja, Mauritania: Tidjikja Airport"
5272,TIZ,"Tari, Papua New Guinea: Tari Airport"
5273,TJA,"Tarija, Bolivia: Cap Av Oriel Lea Plaza International"
5274,TJI,"Trujillo, Honduras: Trujillo Airport"
5275,TJM,"Tyumen, Russia: Roshchino"
5276,TK1,"Ankara, Turkey: Akinci"
5277,TKA,"Talkeetna, AK: Talkeetna Airport"
5278,TKC,"Tiko, Cameroon: Tiko Airport"
5279,TKD,"Takoradi, Ghana: Takoradi Airport"
5280,TKE,"Tenakee, AK: Tenakee Airport"
5281,TKF,"Truckee, CA: Truckee Tahoe"
5282,TKG,"Bandar Lampung, Indonesia: Branti"
5283,TKH,"Takhli, Thailand: Takhli Airport"
5284,TKI,"Tokeen, AK: Tokeen Airport"
5285,TKJ,"Tok, AK: Tok Junction"
5286,TKK,"Chuuk, Federated States of Micronesia: Chuuk International"
5287,TKL,"Taku Lodge, AK: Taku Seaplane Base"
5288,TKM,"Tikal, Guatemala: Tikal Airport"
5289,TKQ,"Kigoma, Tanzania: Kigoma Airport"
5290,TKR,"Thakurgaon, Bangladesh: Thakurgaon Stol Port"
5291,TKS,"Tokushima, Japan: Tokushima Airport"
5292,TKT,"Tak, Thailand: Tak Airport"
5293,TKU,"Turku, Finland: Turku Airport"
5294,TLA,"Teller, AK: Teller Airport"
5295,TLC,"Toluca, Mexico: Licenciado Adolfo Lopez Mateos International"
5296,TLE,"Tulear, Madagascar: Tulear Airport"
5297,TLF,"Telida, AK: Telida Airport"
5298,TLH,"Tallahassee, FL: Tallahassee International"
5299,TLJ,"Tatalina, AK: Tatalina LRRS"
5300,TLK,"Tikchik Lodge, AK: Tikchik Lodge Airport"
5301,TLL,"Tallinn, Estonia: Lennart Meri Tallinn"
5302,TLM,"Tlemcen, Algeria: Zenata-Messali El Hadj"
5303,TLN,"Toulon/Hyeres, France: Hyeres Le Palyvestre"
5304,TLR,"Tulare, CA: Mefford Field"
5305,TLS,"Toulouse, France: Toulouse Blagnac"
5306,TLT,"Tuluksak, AK: Tuluksak Airport"
5307,TLV,"Tel Aviv, Israel: Ben Gurion"
5308,TMA,"Tifton, GA: Henry Tift Myers"
5309,TMB,"Miami, FL: Miami Executive"
5310,TMD,"Timbedra, Mauritania: Timbedra Airport"
