,Code,Description
0,01A,"Afognak Lake, AK: Afognak Lake Airport"
1,03A,"Granite Mountain, AK: Bear Creek Mining Strip"
2,04A,"Lik, AK: Lik Mining Camp"
3,05A,"Little Squaw, AK: Little Squaw Airport"
4,06A,"Kizhuyak, AK: Kizhuyak Bay"
5,07A,"Klawock, AK: Klawock Seaplane Base"
6,08A,"Elizabeth Island, AK: Elizabeth Island Airport"
7,09A,"Homer, AK: Augustin Island"
8,1B1,"Hudson, NY: Columbia County"
9,1G4,"Peach Springs, AZ: Grand Canyon West"
10,1N7,"Blairstown, NJ: Blairstown Airport"
11,1NY,"Penn Yan, NY: Penn Yan Airport"
12,6B0,"Middlebury, VT: Middlebury State"
13,7AK,"Akun, AK: Akun Airport"
14,8F3,"Crosbyton, TX: Crosbyton Municipal"
15,A01,"Fairbanks/Ft. Wainwright, AK: Blair Lake"
16,A02,"Deadmans Bay, AK: Deadmans Bay Airport"
17,A03,"Hallo Bay, AK: Hallo Bay Airport"
18,A04,"Red Lake, AK: Red Lake Airport"
19,A05,"Shell Lake, AK: Shell Lake Airport"
20,A06,"Kougarok, AK: Navigator Airstrip"
21,A07,"Selawik, AK: Roland Norton Memorial"
22,A08,"Pillar Bay, AK: Pillar Bay Airport"
23,A09,"Johnstone Point, AK: Johnstone Point Airport"
24,A11,"Bell Creek, AK: Bell Creek Airport"
25,A12,"Cinnabar, AK: Cinnabar Airport"
26,A13,"Mountaintop Mine, AK: Mountaintop Mine Airport"
27,A14,"Whitebear, AK: Whitebear Airport"
28,A15,"Puviaq, AK: Puviaq Airport"
29,A16,"Arley Lake, AK: Arley Lake Airport"
30,A17,"Port Vita, AK: Port Vita Airport"
31,A18,"Kantishna, AK: Kantishna Airport"
32,A1K,"Deadhorse1, AK: Point Thomson Airstrip"
33,A20,"Alpine, AK: Alpine Airstrip"
34,A21,"Serpentine, AK: Serpentine Airport"
35,A22,"Driftwood Bay, AK: Driftwood Bay Airport"
36,A23,"Bradley Lake, AK: Bradley Lake Airport"
37,A24,"Chilkat Lake, AK: Chilkat Lake Airport"
38,A25,"Nugget Creek, AK: Nugget Creek Airport"
39,A26,"Ivotuk, AK: Ivotuk Airstrip"
40,A27,"Pogo Mines, AK: Pogo Mines Airport"
41,A28,"Ayakulik River, AK: Ayakulik River Airport"
42,A29,"Kiluda Bay, AK: Kiluda Bay Airport"
43,A2K,"Bartletts, AK: Bartletts Airport"
44,A30,"Terror Lake, AK: Terror Lake Airport"
45,A31,"Selief Bay, AK: Selief Bay Airport"
46,A34,"Laura Lake, AK: Laura Lake Airport"
47,A35,"Kaktovik, AK: Bullen Point AFS"
48,A36,"Deep Bay, AK: Deep Bay Airport"
49,A37,"Kako, AK: Kako Airport"
50,A38,"Molly Creek, AK: Molly Creek Airport"
51,A39,"Ptarmigan Lake, AK: Ptarmigan Lake Airport"
52,A3K,"Smith Bay, AK: Smith Bay Airport"
53,A40,"Cape Simpson, AK: Cape Simpson Airport"
54,A41,"Kogru River, AK: Kogru River Airport"
55,A42,"Teshepkuk Lake, AK: Teshepkuk Lake Airport"
56,A43,"Kodiak Island, AK: Trident Basin Seaplane Base"
57,A45,"Lake Florence, AK: Lake Florence Airport"
58,A46,"Lake Hasselborg, AK: Lake Hasselborg Airport"
59,A47,"Distin Lake, AK: Distin Lake Airport"
60,A48,"Port Hobron, AK: Port Hobron Airport"
61,A49,"Mooseville Airstrip, AK: Mooseville Airstrip Airport"
62,A4K,"Dune Lake, AK: Dune Lake Airport"
63,A50,"Big Bay, AK: Big Bay Airport"
64,A51,"Wien Lake, AK: Wien Lake Airport"
65,A52,"Silver Salmon Creek, AK: Silver Salmon Creek Airport"
66,A53,"Blear Lake, AK: Blear Lake Airport"
67,A54,"Cannery Bay, AK: Cannery Bay Airport"
68,A56,"Bear Lake, AK: Johnsons Landing"
69,A57,"International Seafoods, AK: International Seafoods Airport"
70,A58,"Cosna River, AK: Cosna River Airport"
71,A59,"Ivatuk, AK: Ivatuk Airport"
72,A61,"Cape Sarichef, AK: Cape Sarichef Airport"
73,A62,"Taylor Mountain Mine, AK: Taylor Mountain"
74,A63,"Yukon Charley Rivvers, AK: Coal Creek"
75,A65,"Karluk Portage, AK: Karluk Portage Airport"
76,A66,"Hope, AK: Hope Airport"
77,A67,"Viekoda Bay, AK: Viekoda Bay Airport"
78,A69,"Cold Bay, AK: Cathedral Strip"
79,A70,"Village Islands, AK: Village Islands Airport"
80,A71,"Homer, AK: Bear Cove Farm"
81,A72,"Chinitna Bay, AK: Chinitna Bay Airport"
82,A73,"McKinley Park, AK: McKinley National Park"
83,A74,"Nanwalek, AK: Dog Fish Bay"
84,A75,"Malina Bay, AK: Malina Bay Airport"
85,A76,"Red Fox Bay, AK: Red Fox Bay Airport"
86,A77,"Shearwater, AK: Shearwater Airport"
87,A78,"Cape Simpson, AK: Lake"
88,A79,"Cape Simpson, AK: Cape Simpson No. 1"
89,A80,"Cape Simpson, AK: Cape Simpson No. 7"
90,A81,"Aglaq, AK: Cape Simpson #1"
91,A82,"Nikiski, AK: Nikiski Private Airstrip"
92,A83,"Petrof Point, AK: Petrof Point Airport"
93,A84,"Denali, AK: Denali West Lodge Private"
94,A85,"Big River, AK: Big River Airport"
95,A87,"Carry Inlet, AK: Carry Inlet Airport"
96,A89,"Montague Island, AK: Montague Island Airport"
97,A90,"Shannon Pond, AK: Shannon Pond Airport"
98,A91,"Omalik Lagoon, AK: Omalik Lagoon Airport"
99,A92,"Omolik Lagoon, AK: Omolik Lagoon Airport"
100,A93,"Bradley Lake Project, AK: Bradley Lake Project Airport"
101,A94,"Barrow, AK: Ice Strip"
102,A95,"Barrow, AK: Ice Strip"
103,A96,"Barrow, AK: Ice Strip"
104,A97,"Akulik, AK: Akulik Air Strip"
105,A98,"Deadfall, AK: Deadfall Air Strip"
106,A99,"Eagle Creek, AK: Eagle Creek Airport"
107,AA1,"Bethel, AK: Ice Kong"
108,AA2,"Naknek-1, AK: Icicle Seafoods"
109,AA4,"Kachemak Bay, AK: Glacier Split"
110,AA5,"Selby Lake, AK: Selby Lake Airport"
111,AA7,"Independence Creek, AK: Independence Creek Airport"
112,AA8,"Deadhorse, AK: Badami"
113,AAA,"Anaa, French Polynesia: Anaa Airport"
114,AAB,"Arrabury, Australia: Arrabury Station"
115,AAC,"El Arish, Egypt: El Arish International"
116,AAD,"Ad-Dabbah, Sudan: Ad-Dabbah Airport"
117,AAE,"Annaba, Algeria: Rabah Bitat"
118,AAF,"Apalachicola, FL: Apalachicola Regional Cleve Randolph Field"
119,AAH,"Aachen, Germany: Aachen/Merzbruck"
120,AAI,"Arraias, Brazil: Arraias Airport"
121,AAL,"Aalborg, Denmark: Aalborg Airport"
122,AAM,"Mala Mala, South Africa: Malamala"
123,AAN,"Al Ain, United Arab Emirates: Al Ain International"
124,AAO,"Anaco, Venezuela: Anaco Airport"
125,AAQ,"Anapa, Russia: Anapa Airport"
126,AAR,"Aarhus, Denmark: Aarhus Airport"
127,AAU,"Asau, Samoa: Asau W Sam"
128,AAX,"Araxa, Brazil: Araxa Airport"
129,ABA,"Abakan, Russia: Abakan Airport"
130,ABD,"Abadan, Iran: Abadan Airport"
131,ABE,"Allentown/Bethlehem/Easton, PA: Lehigh Valley International"
132,ABI,"Abilene, TX: Abilene Regional"
133,ABJ,"Abidjan, Cote d'Ivoire: Felix Houphouet Boigny Abidjan International"
134,ABK,"Kabri Dar, Ethiopia: Kebri Dahar"
135,ABL,"Ambler, AK: Ambler River"
136,ABQ,"Albuquerque, NM: Albuquerque International Sunport"
137,ABR,"Aberdeen, SD: Aberdeen Regional"
138,ABS,"Abu Simbel, Egypt: Abu Simbel Airport"
139,ABT,"Al-Baha, Saudi Arabia: Al-Baha Airport"
140,ABV,"Abuja, Nigeria: Abuja Nnamdi Azikiwe International"
141,ABX,"Albury, Australia: Albury Airport"
142,ABY,"Albany, GA: Southwest Georgia Regional"
143,ABZ,"Aberdeen, United Kingdom: Aberdeen Dyce"
144,ACA,"Acapulco, Mexico: General Juan N Alvarez International"
145,ACB,"Bellaire, MI: Antrim County"
146,ACC,"Accra, Ghana: Accra Kotoka International"
147,ACE,"Arrecife, Spain: Lanzarote"
148,ACH,"Altenrhein, Switzerland: St Gallen Altenrhein"
149,ACI,"Alderney, United Kingdom: Alderney Airport"
150,ACK,"Nantucket, MA: Nantucket Memorial"
151,ACT,"Waco, TX: Waco Regional"
152,ACU,"Achutupo, Panama: Achutupo Airport"
153,ACV,"Arcata/Eureka, CA: Arcata"
154,ACY,"Atlantic City, NJ: Atlantic City International"
155,ADA,"Adana, Turkey: Adana International"
156,ADB,"Izmir, Turkey: Adnan Menderes"
157,ADC,"Andakombe, Papua New Guinea: Andakombe Airport"
158,ADD,"Addis Ababa, Ethiopia: Bole International"
159,ADE,"Aden, Yemen: Aden International"
160,ADJ,"Amman, Jordan: Marka International"
161,ADK,"Adak Island, AK: Adak"
162,ADL,"Adelaide, Australia: Adelaide International"
163,ADM,"Ardmore, OK: Ardmore Municipal"
164,ADN,"Andes, Colombia: Andes Airport"
165,ADO,"Andamooka, Australia: Andamooka Airport"
166,ADQ,"Kodiak, AK: Kodiak Airport"
167,ADS,"Dallas, TX: Addison"
168,ADT,"Ada, OK: Ada Municipal"
169,ADW,"Camp Springs, MD: Joint Base Andrews"
170,ADX,"St Andrews, United Kingdom: RAF Leuchars"
171,ADZ,"San Andres Island, Colombia: Gustavo Rojas Pinilla"
172,AE1,"Liwa, United Arab Emirates: Liwa Airbase"
173,AED,"Aleneva, AK: Aleneva Airport"
174,AEG,"Padang Sidempuan, Indonesia: Aek Godang"
175,AEH,"Abeche, Chad: Abeche Airport"
176,AEO,"Aioun El Atrouss, Mauritania: Aioun El Atrouss Airport"
177,AEP,"Buenos Aires, Argentina: Aeroparque Jorge Newbery"
178,AER,"Adler/Sochi, Russia: Adler/Sochi Airport"
179,AES,"Aalesund, Norway: Vigra"
180,AET,"Allakaket, AK: Allakaket Airport"
181,AEX,"Alexandria, LA: Alexandria International"
182,AEY,"Akureyri, Iceland: Akureyri Airport"
183,AF1,"Bagram, Afghanistan: Bagram Air Base"
184,AF2,"Lashkar Gah, Afghanistan: Bastion Airfield"
185,AF3,"Dwyer, Afghanistan: Dwyer Airport"
186,AF4,"Shindand, Afghanistan: Shindand Airport"
187,AFA,"San Rafael, Argentina: San Rafael Airport"
188,AFF,"Colorado Springs, CO: USAF Academy Airfield"
189,AFK,"Nebraska, NE: Nebraska City Municipal"
190,AFO,"Afton, WY: Afton Municipal"
191,AFP,"Wadesboro, NC: Anson County"
192,AFU,"Doha, Qatar: Al Udeid Air Base"
193,AFW,"Dallas/Fort Worth, TX: Fort Worth Alliance"
194,AFY,"Afyon, Turkey: Afyon Airport"
195,AGA,"Agadir, Morocco: Inezgane"
196,AGB,"Augsburg, Germany: Augsburg Airport"
197,AGC,"Pittsburgh, PA: Allegheny County"
198,AGF,"Agen, France: Agen La Garenne"
199,AGG,"Angoram, Papua New Guinea: Angoram Airport"
200,AGH,"Angelholm/Helsingborg, Sweden: Angelholm"
201,AGK,"Kagua, Papua New Guinea: Kagua Airport"
202,AGL,"Wanigela, Papua New Guinea: Wanigela Airport"
203,AGN,"Angoon, AK: Angoon Seaplane Base"
204,AGP,"Malaga, Spain: Malaga Costa del Sol"
205,AGQ,"Agrinion, Greece: Agrinion Airport"
206,AGR,"Agra, India: Agra Airport"
207,AGS,"Augusta, GA: Augusta Regional at Bush Field"
208,AGT,"Ciudad del Este, Paraguay: Guarani International"
209,AGU,"Aguascalientes, Mexico: Jesus Teran International"
210,AGV,"Acarigua, Venezuela: Oswaldo Guevara Mujica"
211,AGX,"Agatti Island, India: Agatti Island Airport"
212,AHA,"Okinawa, Japan: Naha AB"
213,AHB,"Abha, Saudi Arabia: Abha Airport"
214,AHD,"Ardmore, OK: Ardmore Downtown Executive"
215,AHN,"Athens, GA: Athens/Ben Epps"
216,AHO,"Alghero/Sassari, Italy: Alghero"
217,AHS,"Ahuas, Honduras: Auas"
218,AHT,"Amchitka Island, AK: Amchitka"
219,AHU,"Al Hoceima, Morocco: Cherif El Idrissi International"
220,AIA,"Alliance, NE: Alliance Municipal"
221,AIB,"Anita Bay, AK: Anita Bay Airport"
222,AID,"Anderson, IN: Anderson Municipal-Darlington Field"
223,AIK,"Aiken, SC: Aiken Municipal"
224,AIN,"Wainwright, AK: Wainwright Airport"
225,AIT,"Aitutaki, Cook Islands: Aitutaki Airport"
226,AIY,"Atlantic City, NJ: Bader Field"
227,AIZ,"Lake of the Ozarks, MO: Lee C Fine Memorial"
228,AJA,"Ajaccio, France: Ajaccio Napoleon Bonaparte"
229,AJF,"Jouf, Saudi Arabia: Al Jouf"
230,AJJ,"Akjoujt, Mauritania: Akjoujt Airport"
231,AJL,"Aizwal, India: Lengpui"
232,AJN,"Anjouan, Comoros: Ouani"
233,AJR,"Arvidsjaur, Sweden: Arvidsjaur Airport"
234,AJU,"Aracaju, Brazil: Santa Maria"
235,AJY,"Agades, Niger: Mano Dayak"
236,AK1,"Seward Peninsula, AK: Kelly Creek Airstrip"
237,AK2,"Bear Fish Camp, AK: Bear Fish Camp Airport"
238,AK3,"Fairbanks, AK: Gold King Creek"
239,AK4,"Squaw Lake, AK: Squaw Lake Airport"
240,AK5,"Qugruc, AK: Qugruc Airport"
241,AK6,"Gold King 2, AK: Gold King 2 Airport"
242,AK7,"Rampart, AK: Hunter Creek"
243,AK8,"Zips, AK: Zips Airport"
244,AK9,"Tolstoi Bay, AK: Tolstoi Bay Airport"
245,AKB,"Atka, AK: Atka Airport"
246,AKC,"Akron, OH: Akron Fulton International"
247,AKF,"Kufrah, Libya: Kufra"
248,AKH,"Al Kharj, Saudi Arabia: Prince Sultan AB"
249,AKI,"Akiak, AK: Akiak Airport"
250,AKJ,"Asahikawa, Japan: Asahikawa Airport"
251,AKK,"Akhiok, AK: Akhiok Airport"
252,AKL,"Auckland, New Zealand: Auckland International"
253,AKN,"King Salmon, AK: King Salmon Airport"
254,AKO,"Akron, CO: Colorado Plains Regional"
255,AKP,"Anaktuvuk Pass, AK: Anaktuvuk Pass Airport"
256,AKR,"Akure, Nigeria: Akure Airport"
257,AKS,"Auki, Solomon Islands: Auki Airport"
258,AKT,"Akrotiri, Cyprus: Akrotiri Airport"
259,AKX,"Aktyubinsk, Kazakhstan: Aktyubinsk Airport"
260,AKY,"Sittwe, Burma: Sittwe Airport"
261,AL1,"Albertville, AL: Albertville Regional-Thomas J Brumlik Field"
262,AL2,"Alabaster, AL: Shelby County"
263,AL3,"Huntsville, AL: Huntsville Executive Airport Tom Sharp Jr"
264,AL4,"Andalusia/Opp, AL: South Alabama Regional at Bill Benton Field"
265,AL5,"Demopolis, AL: Demopolis Regional"
266,AL6,"Fairhope, AL: H. L. Sonny Callahan"
267,AL7,"Jasper, AL: Walker County Bevill Field"
268,ALA,"Almaty, Kazakhstan: Almaty Airport"
269,ALB,"Albany, NY: Albany International"
270,ALC,"Alicante, Spain: Alicante Elche"
271,ALE,"Alpine, TX: Alpine Casparis Municipal"
272,ALF,"Alta, Norway: Alta Airport"
273,ALG,"Algiers, Algeria: Houari Boumediene"
274,ALH,"Albany, Australia: Albany Airport"
275,ALI,"Alice, TX: Alice International"
276,ALJ,"Alexander Bay, South Africa: Alexander Bay Airport"
277,ALK,"Asela, Ethiopia: Asela Airport"
278,ALM,"Alamogordo, NM: Alamogordo White Sands Regional"
279,ALN,"Alton, IL: St. Louis Regional"
280,ALO,"Waterloo, IA: Waterloo Regional"
281,ALP,"Aleppo, Syria: Aleppo International"
282,ALQ,"Alegrete, Brazil: Alegrete Airport"
283,ALR,"Alexandra, New Zealand: Alexandra Airport"
284,ALS,"Alamosa, CO: San Luis Valley Regional/Bergman Field"
285,ALT,"Alenquer, Brazil: Alenquer Airport"
286,ALU,"Alula, Somalia: Alula Airport"
287,ALW,"Walla Walla, WA: Walla Walla Regional"
288,ALX,"Alexander City, AL: Thomas C. Russell Field"
289,ALY,"Alexandria, Egypt: Alexandria International"
290,ALZ,"Lazy Bay, AK: Alitak Seaplane Base"
291,AMA,"Amarillo, TX: Rick Husband Amarillo International"
292,AMD,"Ahmedabad, India: Ahmedabad Airport"
293,AMF,"Ama, Papua New Guinea: Ama Airport"
294,AMG,"Amboin, Papua New Guinea: Amboin Airport"
295,AMH,"Arba Minch, Ethiopia: Arba Minch Airport"
296,AMI,"Mataram, Indonesia: Selaparang"
297,AMK,"Durango, CO: Animas Air Park"
298,AML,"Puerto Armuelles, Panama: Puerto Armuelles Airport"
299,AMM,"Amman, Jordan: Queen Alia International"
300,AMN,"Alma, MI: Gratiot Community"
301,AMO,"Mao, Chad: Mao Airport"
302,AMP,"Ampanihy, Madagascar: Ampanihy Airport"
303,AMQ,"Ambon, Indonesia: Pattimura"
304,AMS,"Amsterdam, Netherlands: Schiphol"
305,AMW,"Ames, IA: Ames Municipal"
306,AMX,"Ammaroo, Australia: Ammaroo Station"
307,AMY,"Ambatomainty, Madagascar: Ambatomainty Airport"
308,ANA,"Anaheim, CA: Anaheim-Disneyland HP"
309,ANB,"Anniston, AL: Anniston Regional"
310,ANC,"Anchorage, AK: Ted Stevens Anchorage International"
311,AND,"Anderson, SC: Anderson Regional"
312,ANE,"Angers, France: Angers Marce"
313,ANF,"Antofagasta, Chile: Andres Sabella International"
314,ANG,"Angouleme, France: Angouleme Brie Champniers"
315,ANI,"Aniak, AK: Aniak Airport"
316,ANK,"Ankara, Turkey: Etimesgut"
317,ANM,"Antalaha, Madagascar: Antsirabato"
318,ANN,"Annette, AK: Annette Island"
319,ANO,"Angoche, Mozambique: Angoche Airport"
320,ANP,"Annapolis, MD: Lee"
321,ANR,"Antwerp, Belgium: Deurne"
322,ANS,"Andahuaylas, Peru: Andahuaylas Airport"
323,ANU,"St. Johns, Antigua and Barbuda: V C Bird International"
324,ANV,"Anvik, AK: Anvik Airport"
325,ANX,"Andeness, Norway: Andoya"
326,AOH,"Lima, OH: Lima Allen County"
327,AOI,"Ancona, Italy: Falconara"
328,AOJ,"Aomori, Japan: Aomori Airport"
329,AOK,"Karpathos, Greece: Karpathos Airport"
330,AOL,"Paso de Los Libres, Argentina: Paso de Los Libres Airport"
331,AOO,"Altoona, PA: Altoona-Blair County"
332,AOR,"Alor Setar, Malaysia: Sultan Abdul Halim"
333,AOS,"Amook Bay, AK: Amook Bay Airport"
334,APA,"Denver, CO: Centennial"
335,APB,"Apolo, Bolivia: Apolo Airport"
336,APC,"Napa, CA: Napa County"
337,APE,"San Juan Aposento, Peru: San Juan Aposento Airport"
338,APF,"Naples, FL: Naples Municipal"
339,APG,"Aberdeen, MD: Phillips AAF"
340,API,"Villavicencio, Colombia: Gomez Nino Apiay AB"
341,APK,"Apataki, French Polynesia: Apataki Airport"
342,APL,"Nampula, Mozambique: Nampula Airport"
343,APN,"Alpena, MI: Alpena County Regional"
344,APO,"Apartado, Colombia: Apartado Airport"
345,APR,"April River, Papua New Guinea: April River Airport"
346,APT,"Jasper, TN: Marion County Brown Field"
347,APV,"Apple Valley, CA: Apple Valley Airport"
348,APW,"Apia, Samoa: Faleolo International"
349,AQI,"Qaisumah, Saudi Arabia: Al Qaisumah"
350,AQJ,"Aqaba, Jordan: Aqaba King Hussein International"
351,AQP,"Arequipa, Peru: Rodriguez Ballon International"
352,AQS,"Saqani, Fiji: Saqani Airport"
353,AQY,"Girdwood, AK: Girdwood Airport"
354,AR1,"Russellville, AR: Russellville Regional"
355,AR2,"Conway, AR: Dennis F Cantrell Field"
356,ARA,"New Iberia, LA: Acadiana Regional"
357,ARB,"Ann Arbor, MI: Ann Arbor Municipal"
358,ARC,"Arctic Village, AK: Arctic Village Airport"
359,ARD,"Alor, Indonesia: Arcadia Municipal"
360,ARE,"Arecibo, PR: Antonio/Nery/Juarbe Pol"
361,ARG,"Walnut Ridge, AR: Walnut Ridge Regional"
362,ARH,"Arkhangelsk, Russia: Arkhangelsk Airport"
363,ARI,"Arica, Chile: Chacalluta"
364,ARK,"Arusha, Tanzania: Arusha Airport"
365,ARM,"Armidale, Australia: Armidale Airport"
366,ARN,"Stockholm, Sweden: Arlanda"
367,ARP,"Aragip, Papua New Guinea: Aragip Airport"
368,ARQ,"Arauquita, Colombia: Arauquita Airport"
369,ARS,"Aragarcas, Brazil: Aragarcas Airport"
370,ART,"Watertown, NY: Watertown International"
371,ARU,"Aracatuba, Brazil: Aracatuba Airport"
372,ARV,"Minocqua/Woodruff, WI: Lakeland/Noble F. Lee Memorial Field"
373,ARW,"Arad, Romania: Arad Airport"
374,ARX,"Asbury Park, NJ: Asbury Park/Monmouth County"
375,ARY,"Ararat, Australia: Ararat Airport"
376,ARZ,"N'zeto, Angola: N'zeto Airport"
377,ASA,"Assab, Eritrea: Assab International"
378,ASB,"Ashgabat, Turkmenistan: Ashgabat Airport"
379,ASC,"Ascension, Bolivia: Ascension Airport"
380,ASD,"Andros Town, The Bahamas: Fresh Creek"
381,ASE,"Aspen, CO: Aspen Pitkin County Sardy Field"
382,ASF,"Astrakhan , Russia: Narimanova"
383,ASG,"Ashburton, New Zealand: Ashburton Airport"
384,ASH,"Nashua, NH: Boire Field"
385,ASI,"Ascension Island, Saint Helena, Ascension, and Tristan da Cunha: Ascension Aux Af"
386,ASJ,"Amami O Shima, Japan: Amami"
387,ASK,"Yamoussoukro, Cote d'Ivoire: Yamoussoukro Airport"
388,ASL,"Marshall, TX: Harrison County"
389,ASM,"Asmara, Eritrea: Asmara International"
390,ASN,"Talladega, AL: Talladega Municipal"
391,ASO,"Asosa, Ethiopia: Asosa Hidase"
392,ASP,"Alice Springs, Australia: Alice Springs Airport"
393,ASQ,"Austin, NV: Austin Airport"
394,ASR,"Kayseri, Turkey: Kayseri Airport"
395,AST,"Astoria/Seaside, OR: Astoria Regional"
396,ASU,"Asuncion, Paraguay: Silvio Pettirossi International"
397,ASW,"Aswan, Egypt: Aswan International"
398,ASX,"Ashland, WI: John F Kennedy Memorial"
399,ASY,"Ashley, ND: Ashley Municipal"
400,ATA,"Anta, Peru: Anta Huaraz"
401,ATB,"Atbara, Sudan: Atbara Airport"
402,ATC,"Arthur's Town, The Bahamas: Arthur's Town Airport"
403,ATE,"Antlers, OK: Antlers Municipal"
404,ATH,"Athens, Greece: Eleftherios Venizelos International"
405,ATI,"Artigas, Uruguay: Artigas International"
406,ATK,"Atqasuk, AK: Atqasuk Edward Burnell Sr. Memorial"
407,ATL,"Atlanta, GA: Hartsfield-Jackson Atlanta International"
408,ATM,"Altamira, Brazil: Altamira Airport"
409,ATN,"Namatanai, Papua New Guinea: Namatanai Airport"
410,ATO,"Athens, OH: Ohio University"
411,ATP,"Aitape, Papua New Guinea: Aitape Airport"
412,ATQ,"Amritsar, India: Amritsar Airport"
413,ATR,"Atar, Mauritania: Atar Airport"
414,ATS,"Artesia, NM: Artesia Municipal"
415,ATT,"Atmautluak, AK: Atmautluak Airport"
416,ATU,"Attu, AK: Casco Cove CGS"
417,ATV,"Ati, Chad: Ati Airport"
418,ATW,"Appleton, WI: Appleton International"
419,ATY,"Watertown, SD: Watertown Regional"
420,ATZ,"Assiut, Egypt: Assiut Airport"
421,AU1,"Weipa, Australia: Scherger"
422,AUA,"Aruba, Aruba: Reina Beatrix International"
423,AUC,"Arauca, Colombia: Santiago Perez"
424,AUD,"Augustus Downs, Australia: Augustus Downs Airport"
425,AUG,"Augusta/Waterville, ME: Augusta State"
426,AUH,"Abu Dhabi, United Arab Emirates: Abu Dhabi International"
427,AUI,"Aua Island, Papua New Guinea: Aua Island Airport"
428,AUK,"Alakanuk, AK: Alakanuk Airport"
429,AUM,"Austin/Albert Lea, MN: Austin Municipal"
430,AUN,"Auburn, CA: Auburn Municipal"
431,AUO,"Auburn, AL: Auburn University Regional"
432,AUP,"Aguan, Papua New Guinea: Aguan Papua N.G."
433,AUQ,"Atuona, French Polynesia: Hiva Oa/Atuona"
434,AUR,"Aurillac, France: Aurillac Airport"
435,AUS,"Austin, TX: Austin - Bergstrom International"
436,AUW,"Wausau, WI: Wausau Downtown"
437,AUX,"Araguaina, Brazil: Araguaina Airport"
438,AUY,"Aneityum, Vanuatu: Aneityum Airport"
439,AUZ,"Aurora, IL: Aurora Municipal"
440,AVB,"Aviano, Italy: Aviano AB"
441,AVI,"Ciego de Avila, Cuba: Maximo Gomez"
442,AVL,"Asheville, NC: Asheville Regional"
443,AVN,"Avignon, France: Avignon Caumont"
444,AVO,"Avon Park, FL: Avon Park Executive"
445,AVP,"Scranton/Wilkes-Barre, PA: Wilkes Barre Scranton International"
446,AVV,"Avalon, Australia: Avalon Airport"
447,AVW,"Tucson, AZ: Marana Regional"
448,AVX,"Avalon, CA: Catalina"
449,AWA,"Awasa, Ethiopia: Lake Awasa"
450,AWK,"Wake Island, TT: Wake Island Airfield"
451,AWM,"West Memphis, AR: West Memphis Municipal"
452,AWR,"Awar, Papua New Guinea: Awar Airport"
453,AWX,"Andrews, TX: Andrews County"
454,AWZ,"Ahwaz, Iran: Ahwaz Airport"
455,AXA,"The Valley, Anguilla: Clayton J. Lloyd"
456,AXB,"Alexandria Bay, NY: Maxson Airfield"
457,AXC,"Aramac, Australia: Aramac Airport"
458,AXD,"Alexandroupolis, Greece: Dimokritos"
459,AXM,"Armenia, Colombia: El Eden"
460,AXN,"Alexandria, MN: Chandler Field"
461,AXP,"Spring Point, The Bahamas: Spring Point Airport"
462,AXS,"Altus, OK: Altus/Quartz Mountain Regional"
463,AXT,"Akita, Japan: Akita Airport"
464,AXU,"Axum, Ethiopia: Axum Airport"
465,AXV,"Wapakoneta, OH: Neil Armstrong"
466,AXX,"Eagle Nest, NM: Angel Fire"
467,AYL,"Anthony Lagoon, Australia: Anthony Lagoon Airport"
468,AYP,"Ayacucho, Peru: Coronel FAP Alfredo Mendivil Duarte"
469,AYQ,"Ayers Rock, Australia: Ayers Rock Connellan"
470,AYR,"Ayr, Australia: Ayr Airport"
471,AYS,"Waycross, GA: Waycross-Ware County"
472,AYT,"Antalya, Turkey: Antalya Airport"
473,AYW,"Ayawasi, Indonesia: Ayawasi Airport"
474,AZ1,"Grand Canyon, AZ: Valle"
475,AZ2,"Williams, AZ: H. A. Clark Memorial Field"
476,AZ3,"Glendale, AZ: Glendale Municipal"
477,AZ4,"Salome, AZ: Sheepy Hollow Ranch"
478,AZ5,"Springerville, AZ: Springerville Municipal"
479,AZ6,"Gila Bend, AZ: Gila Bend Municipal"
480,AZA,"Phoenix, AZ: Phoenix - Mesa Gateway"
481,AZD,"Yazd, Iran: Shahid Sadooghi"
482,AZG,"Apatzingan, Mexico: Pablo L. Sidar"
483,AZI,"Abu Dhabi, United Arab Emirates: Al Bateen Executive"
484,AZO,"Kalamazoo, MI: Kalamazoo/Battle Creek International"
485,AZS,"Samana, Dominican Republic: El Catey International"
486,B19,"Biddeford, ME: Biddeford Municipal"
487,B1C,"Baker Island, Canada: Blackfish Lodge"
488,B21,"Carrabassett, ME: Sugarloaf Regional"
489,B2C,"Blind Channel, Canada: Blind Channel Water Aerodrome"
490,B3C,"Minstrel Island, Canada: Minstrel Island Water Aerodrome"
491,B4C,"Simoom Sound, Canada: Simoom Sound Water Aerodrome"
492,BAA,"Bialla, Papua New Guinea: Bialla Airport"
493,BAB,"Marysville, CA: Beale AFB"
494,BAC,"Barranca de Upia, Colombia: Barranca de Upia Airport"
495,BAD,"Shreveport, LA: Barksdale AFB"
496,BAE,"Barcelonnette, France: Barcelonnette Airport"
497,BAF,"Westfield, MA: Westfield Barnes Regional"
498,BAG,"Baguio, Philippines: Baguio Airport"
499,BAH,"Manama, Bahrain: Bahrain International"
500,BAI,"Buenos Aires, Costa Rica: Buenos Aires Airport"
501,BAK,"Baku, Azerbaijan: Baku Metropolitan Area"
502,BAL,"Batman, Turkey: Batman Airport"
503,BAM,"Battle Mountain, NV: Battle Mountain Airport"
504,BAO,"Ban Mak Khaeng, Thailand: Udorn AB"
505,BAQ,"Barranquilla, Colombia: Ernesto Cortissoz"
506,BAR,"Baker Island, AK: Baker AAF"
507,BAT,"Barretos, Brazil: Chafei Amsei"
508,BAU,"Bauru, Brazil: Bauru-Arealva"
509,BAV,"Baotou, China: Baotou Airport"
510,BAX,"Barnaul, Russia: Barnaul Airport"
511,BAY,"Baia Mare, Romania: Baia Mare Airport"
512,BAZ,"Barcelos, Brazil: Barcelos Airport"
513,BBA,"Balmaceda, Chile: Balmaceda Airport"
514,BBC,"Bay City, TX: Bay City Municipal"
515,BBD,"Brady, TX: Curtis Field"
516,BBF,"Burlington, MA: N Eng Heliport"
517,BBH,"Al-Baha, Saudi Arabia: Al-Baha Airport"
518,BBI,"Bhubaneswar, India: Bhubaneswar Airport"
519,BBO,"Berbera, Somalia: Berbera International"
520,BBQ,"Barbuda, Antigua and Barbuda: Cocoa Point"
521,BBR,"Basse Terre, Guadeloupe: Baillif"
522,BBS,"Blackbushe, United Kingdom: Blackbushe Airport"
523,BBT,"Berberati, Central African Republic: Berberati Airport"
524,BBU,"Bucharest, Romania: Baneasa Aurel Vlaicu"
525,BBW,"Broken Bow, NE: Broken Bow Municipal Kieth Glaze Field"
526,BBX,"Blue Bell, PA: Wings Field"
527,BBY,"Bambari, Central African Republic: Bambari Airport"
528,BBZ,"Zambezi, Zambia: Zambezi Airport"
529,BC1,"Port Harvey, Canada: Port Harvey Water Aerodrome"
530,BC2,"Berry Island, Canada: Farewell Harbour"
531,BC3,"Bliss Landing, Canada: Bliss Landing Water Aerodrome"
532,BC4,"Cordero Lodge, Canada: Cordero Lodge Airport"
533,BC5,"Dent Island , Canada: Dent Island Lodge"
534,BC6,"Egmont, Canada: Egmont Water Aerodrome"
535,BC7,"Sonora Island, Canada: Sonora Resort"
536,BC8,"Hanson Island, Canada: Pacific Outback Resort"
537,BC9,"Mink Island, Canada: Mink Island Water Aerodrome"
538,BCA,"Baracoa, Cuba: Gustavo Rizo"
539,BCB,"Blacksburg, VA: Virginia Tech/Montgomery Executive"
540,BCC,"Bear Creek, AK: Bear Creek Airport"
541,BCD,"Bacolod, Philippines: Bacolod Airport"
542,BCE,"Bryce Canyon, UT: Bryce Canyon Airport"
543,BCH,"Baucau, Timor-Leste: Cakung"
544,BCI,"Barcaldine, Australia: Barcaldine Airport"
545,BCJ,"Crestone, CO: Baca Grande"
546,BCL,"Barra del Colorado, Costa Rica: Barra del Colorado Airport"
