,Code,Description
3207,MAO,"Manaus, Brazil: Eduardo Gomes International"
3208,MAP,"Mamai, Papua New Guinea: Mamai Airport"
3209,MAQ,"Mae Sot, Thailand: Mae Sot Airport"
3210,MAR,"Maracaibo, Venezuela: La Chinita International"
3211,MAS,"Manus Island, Papua New Guinea: Momote"
3212,MAT,"Matadi, Congo (Kinshasa): Matadi Tshimpi"
3213,MAU,"Maupiti, French Polynesia: Maupiti Fr. Polynesia"
3214,MAW,"Malden, MO: Malden Regional"
3215,MAX,"Matam, Senegal: Matam Ouro Sogui"
3216,MAY,"Mangrove Cay, The Bahamas: Clarence A Bain"
3217,MAZ,"Mayaguez, PR: Eugenio Maria de Hostos"
3218,MBA,"Mombasa, Kenya: Mombasa Moi International"
3219,MBE,"Monbetsu, Japan: Monbetsu Airport"
3220,MBH,"Maryborough, Australia: Maryborough Qld"
3221,MBI,"Mbeya, Tanzania: Mbeya Airport"
3222,MBJ,"Montego Bay, Jamaica: Sangster International"
3223,MBK,"Matupa, Brazil: Matupa Airport"
3224,MBL,"Manistee/Ludington, MI: Manistee County-Blacker"
3225,MBO,"Mamburao, Philippines: Mamburao Airport"
3226,MBS,"Saginaw/Bay City/Midland, MI: MBS International"
3227,MBT,"Masbate, Philippines: Masbate Airport"
3228,MBU,"Mbambanakira, Solomon Islands: Mbambanakira Airport"
3229,MBX,"Maribor, Slovenia: Maribor Airport"
3230,MBY,"Moberley, MO: Omar N Bradley"
3231,MBZ,"Maues, Brazil: Maues Airport"
3232,MCA,"Macenta, Guinea: Macenta Airport"
3233,MCB,"McComb, MS: McComb/Pike County/John E. Lewis Field"
3234,MCC,"Sacramento, CA: McClellan Airfield"
3235,MCD,"Mackinac Island, MI: Mackinac Island Airport"
3236,MCE,"Merced, CA: Merced Regional/Macready Field"
3237,MCF,"Tampa, FL: Macdill AFB"
3238,MCG,"McGrath, AK: McGrath Airport"
3239,MCH,"Machala, Ecuador: General Manuel Serrano"
3240,MCI,"Kansas City, MO: Kansas City International"
3241,MCJ,"Maicao, Colombia: Maicao Airport"
3242,MCK,"McCook, NE: McCook Ben Nelson Regional"
3243,MCL,"McKinley Park, AK: Denali"
3244,MCM,"Monte Carlo, Monaco: Monaco Heloport"
3245,MCN,"Macon, GA: Middle Georgia Regional"
3246,MCO,"Orlando, FL: Orlando International"
3247,MCP,"Macapa, Brazil: Alberto Alcolumbre"
3248,MCR,"Melchor de Mencos, Guatemala: Melchor de Mencos Airport"
3249,MCS,"Monte Caseros, Argentina: Monte Caseros Airport"
3250,MCT,"Muscat, Oman: Muscat International"
3251,MCU,"Montlucon, France: Gueret/Lepaud"
3252,MCV,"McArthur River, Australia: McArthur River Mine"
3253,MCW,"Mason City, IA: Mason City Municipal"
3254,MCY,"Maroochydore, Australia: Sunshine Coast"
3255,MCZ,"Maceio, Brazil: Zumbi Dos Palmares"
3256,MD1,"Michellville, MD: Freeway"
3257,MDA,"San Antonio, TX: Martindale AHP"
3258,MDB,"Melinda, Belize: Melinda Airport"
3259,MDC,"Menado, Indonesia: Sam Ratulangi"
3260,MDD,"Midland/Odessa, TX: Midland Airpark"
3261,MDE,"Medellin, Colombia: Jose Maria Cordova"
3262,MDF,"Medford, WI: Taylor County"
3263,MDG,"Mudanjiang, China: Hailang"
3264,MDH,"Carbondale, IL: Southern Illinois"
3265,MDI,"Makurdi, Nigeria: Makurdi Airport"
3266,MDJ,"Madras, OR: Madras Municipal"
3267,MDK,"Mbandaka, Congo (Kinshasa): Mbandaka Airport"
3268,MDL,"Mandalay, Burma: Mandalay International"
3269,MDO,"Middleton Island, AK: Middleton Island Airport"
3270,MDQ,"Mar del Plata, Argentina: Mar del Plata Airport"
3271,MDR,"Medfra, AK: Medfra Airport"
3272,MDS,"Middle Caicos, Turks and Caicos Islands: Conch Bar"
3273,MDT,"Harrisburg, PA: Harrisburg International"
3274,MDU,"Mendi, Papua New Guinea: Mendi Airport"
3275,MDW,"Chicago, IL: Chicago Midway International"
3276,MDX,"Mercedes, Argentina: Mercedes Aeroclub"
3277,MDY,"Midway Island, TT: Sand Island Field"
3278,MDZ,"Mendoza, Argentina: El Plumerillo"
3279,ME1,"Rangeley, ME: Steven A. Bean Municipal"
3280,ME2,"Islesboro, ME: Islesboro Airport"
3281,ME3,"Belfast, ME: Belfast Municipal"
3282,ME4,"Oxford, ME: Oxford County Regional"
3283,ME5,"Bethel, ME: Bethel Regional"
3284,ME6,"Bethel2, ME: Cole Dyke"
3285,MEA,"Macae, Brazil: Macae Airport"
3286,MEB,"Melbourne, Australia: Essendon"
3287,MEC,"Manta, Ecuador: Eloy Alfaro International"
3288,MED,"Medina, Saudi Arabia: Prince Mohammad Bin Abdulaziz International"
3289,MEI,"Meridian, MS: Key Field"
3290,MEJ,"Meadville, PA: Port Meadville"
3291,MEL,"Melbourne, Australia: Melbourne International"
3292,MEM,"Memphis, TN: Memphis International"
3293,MEN,"Mende, France: Mende Brenoux"
3294,MEO,"Manteo, NC: Dare County Regional"
3295,MEP,"Mersing, Malaysia: Mersing Malay."
3296,MEQ,"Meulaboh, Indonesia: Seunagan"
3297,MER,"Atwater, CA: Castle"
3298,MES,"Medan, Indonesia: Polonia"
3299,MEV,"Minden, NV: Minden-Tahoe"
3300,MEX,"Mexico City, Mexico: Licenciado Benito Juarez International"
3301,MEY,"Meghauli, Nepal: Meghauli Airport"
3302,MFA,"Mafia Island, Tanzania: Mafia"
3303,MFD,"Mansfield, OH: Mansfield Lahm Regional"
3304,MFE,"Mission/McAllen/Edinburg, TX: McAllen Miller International"
3305,MFF,"Moanda, Gabon: Moanda Airport"
3306,MFG,"Muzaffarabad, Pakistan: Muzaffarabad Airport"
3307,MFH,"Mesquite, NV: Mesquite Airport"
3308,MFI,"Marshfield, WI: Marshfield Municipal"
3309,MFM,"Macau, Macau: Macau International"
3310,MFN,"Milford Sound, New Zealand: Milford Sound Airport"
3311,MFQ,"Maradi, Niger: Maradi Airport"
3312,MFR,"Medford, OR: Rogue Valley International - Medford"
3313,MFS,"Miraflores, Colombia: Miraflores Airport"
3314,MFT,"Fort Worth, TX: Mangham Field"
3315,MFU,"Mfuwe, Zambia: Mfuwe Airport"
3316,MFV,"Melfa, VA: Accomack County"
3317,MGA,"Managua, Nicaragua: Augusto Cesar Sandino International"
3318,MGB,"Mount Gambier, Australia: Mount Gambier Airport"
3319,MGC,"Michigan City, IN: Michigan City Municipal-Phillips Field"
3320,MGD,"Magdalena, Bolivia: Magdalena Airport"
3321,MGE,"Marietta, GA: Dobbins ARB"
3322,MGF,"Maringa, Brazil: Silvio Name Junior"
3323,MGJ,"Montgomery, NY: Orange County"
3324,MGL,"Dusseldorf, Germany: Monchengladbach"
3325,MGM,"Montgomery, AL: Montgomery Regional"
3326,MGN,"Magangue, Colombia: Magangue Airport"
3327,MGQ,"Mogadishu, Somalia: Mogadishu International"
3328,MGR,"Moultrie/Thomasville, GA: Moultrie/Thomasville Airport"
3329,MGS,"Mangaia, Cook Islands: Mangaia Cook Island"
3330,MGW,"Morgantown, WV: Morgantown Municipal-Walter L. Bill Hart Field"
3331,MGY,"Dayton, OH: Dayton-Wright Brothers"
3332,MHA,"Mahdia, Guyana: Mahdia Airport"
3333,MHC,"Dalcahue, Chile: Mocopulli"
3334,MHD,"Mashhad, Iran: Shahid Hashemi Nejad International"
3335,MHE,"Mitchell, SD: Mitchell Municipal"
3336,MHG,"Mannheim, Germany: Mannheim City"
3337,MHH,"Marsh Harbour, The Bahamas: Marsh Harbour International"
3338,MHK,"Manhattan/Ft. Riley, KS: Manhattan Regional"
3339,MHL,"Marshall, MO: Marshall Memorial Municipal"
3340,MHM,"Minchumina, AK: Minchumina Airport"
3341,MHO,"Mount House, Australia: Mount House Airport"
3342,MHQ,"Mariehamn, Finland: Mariehamn Airport"
3343,MHR,"Sacramento, CA: Sacramento Mather"
3344,MHT,"Manchester, NH: Manchester-Boston Regional"
3345,MHV,"Mojave, CA: Mojave Air and Space Port"
3346,MHZ,"Mildenhall, United Kingdom: Mildenhall Airport"
3347,MI1,"Greenville, MI: Greenville Municipal"
3348,MI2,"Holland, MI: West Michigan Regional"
3349,MI3,"Howell, MI: Livingston County Spencer J. Hardy"
3350,MI4,"Frankfort, MI: Frankfort Dow Memorial Field"
3351,MI5,"Boyne Falls, MI: Boyne Mountain"
3352,MI6,"Dowagiac, MI: Dowagiac Municipal"
3353,MIA,"Miami, FL: Miami International"
3354,MIB,"Minot, ND: Minot AFB"
3355,MIC,"Minneapolis, MN: Crystal"
3356,MID,"Merida, Mexico: Licenciado Manuel Crescencio Rejon International"
3357,MIE,"Muncie/Anderson/Newcastle, IN: Delaware County Regional"
3358,MII,"Marilia, Brazil: Marilia Airport"
3359,MIJ,"Mili, Marshall Islands: Mili Airport"
3360,MIK,"Mikkeli, Finland: Mikkeli Airport"
3361,MIL,"Milan, Italy: Milan Metropolitan Area"
3362,MIM,"Merimbula, Australia: Merimbula Airport"
3363,MIN,"Minnipa, Australia: Minnipa Airport"
3364,MIO,"Miami, OK: Miami Regional"
3365,MIP,"Mitspeh Ramon, Israel: Har Arikha"
3366,MIQ,"Omaha, NE: Millard"
3367,MIR,"Monastir, Tunisia: Habib Bourguiba International"
3368,MIS,"Misima Island, Papua New Guinea: Misima"
3369,MIT,"Shafter, CA: Shafter - Minter Field"
3370,MIU,"Maiduguri, Nigeria: Maiduguri Airport"
3371,MIV,"Millville, NJ: Millville Municipal"
3372,MIW,"Marshalltown, IA: Marshalltown Municipal"
3373,MIX,"Miriti, Colombia: Miriti Pirana"
3374,MIZ,"Mainoru, Australia: Mainoru Airport"
3375,MJA,"Manja, Madagascar: Manja Airport"
3376,MJB,"Mejit Island, Marshall Islands: Mejit"
3377,MJC,"Man, Cote d'Ivoire: Man Airport"
3378,MJD,"Moenjodaro, Pakistan: Moenjodaro Airport"
3379,MJF,"Mosjoen, Norway: Kjaerstad"
3380,MJG,"Mayajigua, Cuba: Mayajigua Airport"
3381,MJI,"Mitiga, Libya: Mitiga International"
3382,MJL,"Mouila, Gabon: Mouila Airport"
3383,MJM,"Mbuji-Mayi, Congo (Kinshasa): Mbuji Mayi"
3384,MJN,"Majunga, Madagascar: Philibert Tsiranana"
3385,MJQ,"Jackson, MN: Jackson Airport"
3386,MJT,"Mytilene, Greece: Mitilini"
3387,MJV,"Murcia, Spain: San Javier"
3388,MJX,"Toms River, NJ: Ocean County"
3389,MJZ,"Mirny, Russia: Mirny Airport"
3390,MKA,"Marianske Lazne, Czech Republic: Marianske Lazne Airport"
3391,MKC,"Kansas City, MO: Charles B. Wheeler Downtown"
3392,MKE,"Milwaukee, WI: General Mitchell International"
3393,MKG,"Muskegon, MI: Muskegon County"
3394,MKI,"Obo Mboki, Central African Republic: Obo Mboki Airport"
3395,MKJ,"Makoua, Congo (Brazaville): Makoua Airport"
3396,MKK,"Hoolehua, HI: Molokai"
3397,MKL,"Jackson, TN: McKellar-Sipes Regional"
3398,MKM,"Mukah, Malaysia: Mukah Airport"
3399,MKO,"Muskogee, OK: Davis Field"
3400,MKP,"Makemo, French Polynesia: Makemo Airport"
3401,MKR,"Meekatharra, Australia: Meekatharra Airport"
3402,MKS,"Mekane Selam, Ethiopia: Mekane Selam Airport"
3403,MKT,"Mankato, MN: Mankato Regional"
3404,MKU,"Makokou, Gabon: Makokou Airport"
3405,MKW,"Manokwari, Indonesia: Rendani"
3406,MKY,"Mackay, Australia: Mackay Airport"
3407,MKZ,"Malacca, Malaysia: Malacca Airport"
3408,MLA,"Malta, Malta: Luqa International"
3409,MLB,"Melbourne, FL: Melbourne International"
3410,MLC,"McAlester, OK: McAlester Regional"
3411,MLD,"Malad City, ID: Malad City Airport"
3412,MLE,"Male, Maldives: Ibrahim Nasir International"
3413,MLF,"Milford, UT: Milford Municipal/Ben and Judy Briscoe Field"
3414,MLG,"Malang, Indonesia: Abdul Rachman Saleh"
3415,MLH,"Mulhouse, France: EuroAirport"
3416,MLI,"Moline, IL: Quad City International"
3417,MLK,"Malta, MT: Malta Airport"
3418,MLL,"Marshall, AK: Marshall Don Hunter Sr."
3419,MLM,"Morelia, Mexico: General Francisco J. Mujica International"
3420,MLN,"Melilla, Spain: Melilla Airport"
3421,MLO,"Milos, Greece: Milos Airport"
3422,MLP,"Malabang, Philippines: Malabang Airport"
3423,MLQ,"Malalaua, Papua New Guinea: Malalaua Airport"
3424,MLS,"Miles City, MT: Frank Wiley Field"
3425,MLT,"Millinocket, ME: Millinocket Municipal"
3426,MLU,"Monroe, LA: Monroe Regional"
3427,MLV,"Merluna, Australia: Merluna Airport"
3428,MLW,"Monrovia, Liberia: Monrovia Spriggs Payne"
3429,MLX,"Malatya, Turkey: Malatya Airport"
3430,MLY,"Manley Hot Springs, AK: Manley Hot Springs Airport"
3431,MLZ,"Melo, Uruguay: Melo Airport"
3432,MMA,"Malmo, Sweden: Malmo Metropolitan Area"
3433,MMB,"Memanbetsu, Japan: Memanbetsu Airport"
3434,MMC,"Ciudad Mante, Mexico: Cuauhtemoc"
3435,MMD,"Minami Daito, Japan: Minami Daito Airport"
3436,MME,"Darlington, United Kingdom: Durham Tees Valley"
3437,MMH,"Mammoth Lakes, CA: Mammoth Lakes Airport"
3438,MMI,"Athens, TN: McMinn County"
3439,MMJ,"Matsumoto, Japan: Matsumoto Airport"
3440,MMK,"Murmansk, Russia: Murmansk Airport"
3441,MML,"Marshall, MN: Southwest Minnesota Regional-Marshall/Ryan Field"
3442,MMM,"Middlemount, Australia: Middlemount Airport"
3443,MMN,"Stow, MA: Minute Man Air Field"
3444,MMP,"Mompos, Colombia: Mompos Airport"
3445,MMQ,"Mbala, Zambia: Mbala Airport"
3446,MMT,"Columbia, SC: McEntire Jngb"
3447,MMU,"Morristown, NJ: Morristown Municipal"
3448,MMX,"Malmo, Sweden: Malmo Airport"
3449,MMY,"Miyakojima, Japan: Miyako"
3450,MN1,"Fosston, MN: Fosston Municipal"
3451,MN2,"Moose Lake, MN: Moose Lake Carlton County"
3452,MN3,"Ortonville, MN: Ortonville Municipal-Martinson Field"
3453,MN4,"Wadena, MN: Wadena Municipal"
3454,MN5,"Red Wing, MN: Red Wing Regional"
3455,MN6,"Hallock, MN: Hallock Municipal"
3456,MNB,"Moanda, Congo (Kinshasa): Muanda"
3457,MNC,"Nacala, Mozambique: Nacala International"
3458,MNI,"Montserrat, Montserrat: John A. Osborne"
3459,MNK,"Maiana, Kiribati: Maiana Airport"
3460,MNL,"Manila, Philippines: Ninoy Aquino International"
3461,MNM,"Marinette, MI: Menominee-Marinette Twin County"
3462,MNN,"Marion, OH: Marion Municipal"
3463,MNO,"Manono, Congo (Kinshasa): Manono Airport"
3464,MNR,"Mongu, Zambia: Mongu Airport"
3465,MNS,"Mansa, Zambia: Mansa Airport"
3466,MNT,"Minto, AK: Minto Al Wright"
3467,MNU,"Mawlamyine, Burma: Mawlamyine Airport"
3468,MNX,"Manicore, Brazil: Manicore Airport"
3469,MNZ,"Manassas, VA: Manassas Regional/Harry P. Davis Field"
3470,MO1,"Mosby, MO: Midwest National Air Center"
3471,MO2,"Washington, MO: Washington Regional"
3472,MOA,"Moa, Cuba: Orestes Acosta"
3473,MOB,"Mobile, AL: Mobile Regional"
3474,MOC,"Montes Claros, Brazil: Mario Ribeiro"
3475,MOD,"Modesto, CA: Modesto City-County-Harry Sham Field"
3476,MOG,"Mong Hsat, Burma: Mong Hsat Airport"
3477,MOL,"Molde, Norway: Aro"
3478,MOM,"Moudjeria, Mauritania: Moudjeria Ledfotar"
3479,MON,"Mount Cook, New Zealand: Mount Cook Airport"
3480,MOP,"Mount Pleasant, MI: Mount Pleasant Municipal"
3481,MOQ,"Morondava, Madagascar: Morondava Airport"
3482,MOR,"Morristown, TN: Moore-Murrell"
3483,MOS,"Moses Point, AK: Moses Point Airport"
3484,MOT,"Minot, ND: Minot International"
3485,MOU,"Mountain Village, AK: Mountain Village Airport"
3486,MOW,"Moscow, Russia: Moscow Metropolitan Area"
3487,MOY,"Monterrey, Colombia: Monterrey Airport"
3488,MOZ,"Moorea Island, French Polynesia: Temae"
3489,MPB,"Miami, FL: Watson Island International"
3490,MPE,"Madison, CT: Griswold"
3491,MPI,"Mamitupo, Panama: Mamitupo Airport"
3492,MPJ,"Morrilton, AR: Petit Jean Park"
3493,MPK,"Mokpo, South Korea: Mokpo Airport"
3494,MPL,"Montpellier, France: Montpellier Mediterranee"
3495,MPM,"Maputo, Mozambique: Maputo Airport"
3496,MPN,"Mount Pleasant, Falkland Islands (Islas Malvinas): Mount Pleasant Airport"
3497,MPO,"Mt. Pocono, PA: Pocono Mountains Municipal"
3498,MPR,"McPherson, KS: McPherson Airport"
3499,MPS,"Mount Pleasant, TX: Mount Pleasant Municipal"
3500,MPT,"Maliana, Timor-Leste: Maliana Airport"
3501,MPV,"Montpelier/Barre, VT: Edward F Knapp State"
3502,MPX,"Miyanmin, Papua New Guinea: Miyanmin Airport"
3503,MQB,"Macomb, IL: Macomb Municipal"
3504,MQI,"Quincy, MA: Quincy Airport"
3505,MQJ,"Indianapolis, IN: Indianapolis Regional"
3506,MQL,"Mildura, Australia: Mildura Airport"
3507,MQM,"Mardin, Turkey: Mardin Airport"
3508,MQN,"Mo I Rana, Norway: Rossvoll"
3509,MQP,"Nelspruit, South Africa: Kruger Mpumalanga International"
3510,MQQ,"Moundou, Chad: Moundou Airport"
3511,MQS,"Mustique, Saint Vincent and the Grenadines: Mustique Airport"
3512,MQT,"Marquette, MI: Sawyer International"
3513,MQX,"Mek'ele, Ethiopia: Mek'ele Airport"
3514,MQY,"Smyrna, TN: Smyrna Airport"
3515,MRA,"Misurata, Libya: Misurata International"
3516,MRB,"Martinsburg, WV: Eastern WV Regional/Shepherd Field"
3517,MRC,"Columbia, TN: Maury County"
3518,MRD,"Merida, Venezuela: Alberto Carnevalli"
3519,MRF,"Marfa, TX: Marfa Municipal"
3520,MRH,"Morehead City, NC: Beaufort Morehead City"
3521,MRI,"Anchorage, AK: Merrill Field"
3522,MRK,"Marco Island, FL: Marco Island Airport"
3523,MRN,"Morganton, NC: Morganton Lenoir"
3524,MRO,"Masterton, New Zealand: Masterton Airport"
3525,MRQ,"Marinduque, Philippines: Marinduque Airport"
3526,MRS,"Marseille, France: Marseille Provence"
3527,MRU,"Mauritius Island, Mauritius: Sir Seewoosagur Ramgoolam International"
3528,MRV,"Mineralnyye Vody, Russia: Mineralnyye Vody Airport"
3529,MRX,"Margarita Island, Venezuela: Del Caribe International"
3530,MRY,"Monterey, CA: Monterey Regional"
3531,MRZ,"Moree, Australia: Moree Airport"
3532,MS1,"Grenada, MS: Grenada Municipal"
3533,MS2,"Picayune, MS: Picayune Municipal"
3534,MS3,"Philadelphia, MS: Philadelphia Municipal"
3535,MSA,"Muskrat Dam, Canada: Muskrat Dam Airport"
3536,MSC,"Mesa, AZ: Falcon Field"
3537,MSE,"Manston, United Kingdom: Manston Airport"
3538,MSH,"Masirah, Oman: Masirah Airport"
3539,MSJ,"Misawa, Japan: Misawa AB"
3540,MSL,"Muscle Shoals, AL: Northwest Alabama Regional"
3541,MSN,"Madison, WI: Dane County Regional-Truax Field"
3542,MSO,"Missoula, MT: Missoula International"
3543,MSP,"Minneapolis, MN: Minneapolis-St Paul International"
3544,MSQ,"Minsk, Belarus: Minsk 2"
3545,MSR,"Greven, West Germany: Munster/Osnabruck International"
3546,MSS,"Massena, NY: Massena International-Richards Field"
3547,MST,"Maastricht, Netherlands: Maastricht Airport"
3548,MSU,"Maseru, Lesotho: Moshoeshoe I International"
3549,MSV,"Monticello, NY: Sullivan County International"
3550,MSW,"Massawa, Eritrea: Massawa International"
3551,MSY,"New Orleans, LA: Louis Armstrong New Orleans International"
3552,MSZ,"Namibe, Angola: Yuri Gagarin"
3553,MT1,"Colstrip, MT: Colstrip Airport"
3554,MT2,"Three Forks, MT: Three Forks Airport"
3555,MTC,"Mt. Clemens, MI: Selfridge Angb"
3556,MTD,"Mt. Sandford, Australia: Mount Sanford Station"
3557,MTE,"Monte Alegre, Brazil: Monte Alegre Airport"
3558,MTH,"Marathon, FL: The Florida Keys Marathon International"
3559,MTJ,"Montrose/Delta, CO: Montrose Regional"
3560,MTL,"Maitland, Australia: Maitland Airport"
3561,MTM,"Metlakatla, AK: Metlakatala"
3562,MTN,"Baltimore, MD: Martin State"
3563,MTO,"Mattoon/Charleston, IL: Coles County Memorial"
3564,MTP,"Montauk Point, NY: Sky Portal"
3565,MTR,"Monteria, Colombia: Los Garzones"
3566,MTS,"Manzini, Swaziland: Matsapha"
3567,MTT,"Minatitlan, Mexico: Minatitlan Airport"
3568,MTV,"Mota Lava, Vanuatu: Mota Lava Airport"
3569,MTW,"Manitowoc, WI: Manitowoc County"
3570,MTX,"Fairbanks, AK: Metro Field"
3571,MTY,"Monterrey, Mexico: General Mariano Escobedo International"
3572,MTZ,"Masada, Israel: Israel Bar Yehuda"
3573,MUA,"Munda, Solomon Islands: Munda Airport"
3574,MUB,"Maun, Botswana: Maun Airport"
3575,MUC,"Munich, Germany: Munich Airport"
3576,MUE,"Kamuela, HI: Waimea-Kohala"
3577,MUG,"Mulege, Mexico: Mulege Airport"
3578,MUH,"Mersa Matruh, Egypt: Mersa Matruh Airport"
3579,MUL,"Moultrie, GA: Spence"
3580,MUN,"Maturin, Venezuela: Maturin Airport"
3581,MUO,"Mountain Home, ID: Mountain Home AFB"
3582,MUR,"Marudi, Malaysia: Marudi Airport"
3583,MUT,"Muscatine, IA: Muscatine Municipal"
3584,MUX,"Multan, Pakistan: Multan International"
3585,MUZ,"Musoma, Tanzania: Musoma Airport"
3586,MVB,"Mvengue, Gabon: Mvengue Airport"
3587,MVC,"Monroeville, AL: Monroe County"
3588,MVD,"Montevideo, Uruguay: Carrasco International"
3589,MVF,"Mossoro, Brazil: Dixsept Rosado"
3590,MVJ,"Mandeville, Jamaica: Marlboro"
3591,MVL,"Morrisville, VT: Morrisville Stowe State"
3592,MVM,"Kayenta, AZ: Kayenta Airport"
3593,MVN,"Mount Vernon, IL: Mount Vernon Airport"
3594,MVR,"Maroua, Cameroon: Salak"
3595,MVW,"Burlington/Mount Vernon, WA: Skagit Regional"
3596,MVY,"Martha's Vineyard, MA: Martha's Vineyard Airport"
3597,MVZ,"Masvingo, Zimbabwe: Masvingo International"
3598,MWA,"Marion/Herrin, IL: Williamson County Regional"
3599,MWC,"Milwaukee, WI: Lawrence J Timmerman"
3600,MWD,"Mianwali, Pakistan: Mianwali Airport"
3601,MWH,"Moses Lake, WA: Grant County International"
3602,MWL,"Mineral Wells, TX: Mineral Wells Airport"
3603,MWM,"Windom, MN: Windom Municipal"
3604,MWO,"Middletown, OH: Middletown Regional/Hook Field"
3605,MWQ,"Magwe, Burma: Magway"
3606,MWX,"Muan, South Korea: Muan International"
3607,MWZ,"Mwanza, Tanzania: Mwanza Airport"
3608,MXB,"Masamba, Indonesia: Andi Jemma"
3609,MXC,"Monticello, UT: Monticello Airport"
3610,MXE,"Maxton, NC: Laurinburg-Maxton"
3611,MXF,"Montgomery, AL: Maxwell AFB"
3612,MXG,"Marlboro, MA: Marlboro Airport"
3613,MXH,"Moro, Papua New Guinea: Moro Airport"
3614,MXJ,"Minna, Nigeria: Minna Airport"
3615,MXL,"Mexicali, Mexico: General Rodolfo Sanchez Taboada International"
3616,MXP,"Milan, Italy: Malpensa"
3617,MXS,"Maota, Samoa: Maota Airport"
3618,MXT,"Maintirano, Madagascar: Maintirano Airport"
3619,MXX,"Mora, Sweden: Mora Airport"
3620,MXY,"McCarthy, AK: McCarthy Airport"
3621,MYA,"Moruya, Australia: Moruya Airport"
3622,MYB,"Mayumba, Gabon: Mayumba Airport"
3623,MYC,"Maracay, Venezuela: Maracay Airport"
3624,MYD,"Malindi, Kenya: Malindi Airport"
3625,MYE,"Miyake Jima, Japan: Miyake Jima Airport"
3626,MYF,"San Diego, CA: Montgomery Field"
3627,MYG,"Mayaguana, The Bahamas: Mayaguana Airport"
3628,MYH,"Marble Canyon, AZ: Cliff Dwellers"
3629,MYJ,"Matsuyama, Japan: Matsuyama Airport"
3630,MYK,"May Creek, AK: May Creek Airport"
3631,MYL,"McCall, ID: McCall Municipal"
3632,MYP,"Mary, Turkmenistan: Mary Airport"
3633,MYR,"Myrtle Beach, SC: Myrtle Beach International"
3634,MYT,"Myitkyina, Burma: Myitkyina Airport"
3635,MYU,"Mekoryuk, AK: Mekoryuk Airport"
3636,MYV,"Marysville, CA: Yuba County"
3637,MYW,"Mtwara, Tanzania: Mtwara Airport"
3638,MYY,"Miri, Malaysia: Miri Airport"
3639,MZB,"Mocimboa Da Praia, Mozambique: Mocimboa Da Praia Airport"
3640,MZG,"Makung, Taiwan: Ma Kung AB"
3641,MZI,"Mopti, Mali: Ambodedjo"
3642,MZJ,"Marana, AZ: Pinal Airpark"
3643,MZK,"Marakei, Kiribati: Marakei Airport"
3644,MZL,"Manizales, Colombia: La Nubia"
3645,MZM,"Metz, France: Metz-Nancy Metz-Frescaty"
3646,MZN,"Minj, Papua New Guinea: Minj Airport"
3647,MZO,"Manzanillo, Cuba: Sierra Maestra"
3648,MZR,"Mazar-I-Sherif, Afghanistan: Mawlana Jalaludin Muhammad Balkhi"
3649,MZT,"Mazatlan, Mexico: General Rafael Buelna International"
3650,MZZ,"Marion, IN: Marion Municipal"
3651,N1C,"Cherry Point, NC: Cherry Point MCAS"
3652,N1Y,"Canandaigua, NY: Canandaigua Airport"
3653,N47,"Pottstown, PA: Pottstown Municipal"
3654,N87,"Robbinsville, NJ: Trenton-Robbinsville"
3655,NAA,"Narrabri, Australia: Narrabri Airport"
3656,NAD,"North Adams, MA: Harriman-and-West"
3657,NAG,"Nagpur, India: Dr. Baba Saheb Ambedkar International"
3658,NAK,"Nakhon Ratchasima, Thailand: Nakhon Ratchasima Airport"
3659,NAN,"Nadi, Fiji: Nadi International"
3660,NAO,"Nanchong, China: Nanchong Airport"
3661,NAP,"Naples, Italy: Capodichino"
3662,NAS,"Nassau, The Bahamas: Lynden Pindling International"
3663,NAT,"Natal, Brazil: Augusto Severo"
3664,NAU,"Napuka Islnd, French Polynesia: Napuka"
3665,NAV,"Nevsehir, Turkey: Nevsehir Airport"
3666,NAX,"Kapolei, HI: Barbers Point NAS"
3667,NAZ,"Star Harbour, Solomon Islands: Nana"
3668,NB1,"St Stephen, Canada: St Stephen Airport"
3669,NBA,"Nambaiyufa, Papua New Guinea: Nambaiyufa Airport"
3670,NBC,"Naberevnye Chelny, Russia: Begishevo"
3671,NBG,"New Orleans, LA: New Orleans NAS JRB"
3672,NBJ,"Newburgh, NY: Newburgh Airport"
3673,NBO,"Nairobi, Kenya: Nairobi Jomo Kenyatta International"
3674,NBU,"Glenview, IL: Glenview NAS"
3675,NBW,"Guantanamo, Cuba: Guantanamo Bay NS"
3676,NC1,"Gastonia, NC: Gastonia Municipal"
3677,NC2,"Smithfield, NC: Johnston Regional"
3678,NC3,"Shelby, NC: Shelby-Cleveland County Regional"
3679,NC4,"Currituck, NC: Currituck County Regional"
3680,NC5,"Kenansville, NC: Duplin County"
3681,NC6,"Oxford, NC: Henderson Oxford"
3682,NC7,"Beaufort, NC: Michael J. Smith Field"
3683,NC8,"Burlington, NC: Burlington Alamance Regional"
3684,NC9,"Rockingham, NC: Richmond County"
3685,NCA,"North Caicos, Turks and Caicos Islands: North Caicos International"
3686,NCE,"Nice, France: Nice Cote d'Azur"
3687,NCH,"Nachingwea, Tanzania: Nachingwea Airport"
3688,NCI,"Necocli, Colombia: Necocli Airport"
3689,NCL,"Newcastle, United Kingdom: Newcastle Airport"
3690,NCN,"Chenega, AK: Chenega Bay"
3691,NCO,"North Kingstown, RI: Quonset State Air Reserve National Guard Helipad"
3692,NCP,"Subic Bay, Philippines: Cubi Point NAS"
3693,NCQ,"Marietta, GA: Dobbins ARB"
3694,NCS,"Newcastle, South Africa: Newcastle Airport"
3695,NCT,"Nicoya, Costa Rica: Nicoya Airport"
3696,NCU,"Nukus, Uzbekistan: Nukus Airport"
3697,NCY,"Annecy, France: Annecy Meythet"
3698,ND1,"Kindred, ND: Robert Odegaard Field"
3699,NDB,"Nouadhibou, Mauritania: Nouadhibou Airport"
3700,NDC,"Nanded, India: Nanded Airport"
3701,NDJ,"Ndjamena, Chad: Hassan Djamous"
3702,NDL,"Ndele, Central African Republic: Ndele Airport"
3703,NDR,"Nador, Morocco: El Aroui International"
3704,NDZ,"Cuxhaven, Germany: Nordholz-Spieka"
3705,NE1,"Gothenburg, NE: Quinn Field"
3706,NE2,"Blair, NE: Blair Municipal"
3707,NE3,"York, NE: York Municipal"
3708,NEA,"Brunswick, GA: Glynco NAS"
3709,NEG,"Negril, Jamaica: Negril Airport"
3710,NEK,"Nekempte, Ethiopia: Nekempte Airport"
3711,NEL,"Lakehurst, NJ: Lakehurst/Maxfield Field"
3712,NER,"Neryungri, Russia: Neryungri Airport"
3713,NET,"New Bight, The Bahamas: New Bight Airport"
3714,NEU,"Sam Neua, Laos: Samneua"
3715,NEV,"Nevis, Saint Kitts and Nevis: Vance Winkworth Amory"
3716,NEW,"New Orleans, LA: Lakefront"
3717,NFL,"Fallon, NV: Fallon NAS"
3718,NGA,"Young, Australia: Young Airport"
3719,NGB,"Ningbo, China: Lishe"
3720,NGC,"Grand Canyon, AZ: North Rim"
3721,NGD,"Anegada, British Virgin Islands: Auguste George"
3722,NGE,"N'Gaoundere, Cameroon: N'Gaoundere Airport"
3723,NGF,"Kaneohe, HI: Kaneohe Bay MCAS"
3724,NGM,"Guam, TT: Agana NAS"
3725,NGO,"Nagoya, Japan: Chubu Centrair International"
3726,NGP,"Corpus Christi, TX: Corpus Christi NAS"
3727,NGS,"Nagasaki, Japan: Nagasaki Airport"
3728,NGU,"Norfolk, VA: Norfolk NS"
3729,NGZ,"Alameda, CA: Alameda NAS"
3730,NH1,"Hampton, NH: Hampton Airfield"
3731,NHA,"Nha-Trang, Vietnam: Nha Trang"
3732,NHD,"Dubai, United Arab Emirates: Minhad AB"
3733,NHK,"Patuxent River, MD: Patuxent River NAS"
3734,NHT,"Northolt, United Kingdom: RAF Northolt"
